course_desc,course_number,course_prefix,course_title,dept_name,inst_ipeds,metadata,num_units
"Basic practical course in how to direct a play.  Students direct one-act plays or scenes from full length plays.  Pre: DRAM  101; and DRAM  221 or DRAM  280; or consent of instructor. (Attributes: DA, GCC)",430,DRAM,Directing,Drama,141565,{},3
"A study of works which have established or refined major traditions in modern and contemporary theater, with some reading in critical theory.  Pre: ENG  100T, 100, ESL  100, or 100T and 200-level coursework in literature. (Same as ENG  483) (Attributes: DL)",483,DRAM,Modern/Contemporary Drama,Drama,141565,{},3
Economic principles for non-majors. Emphasis on the applications of theory to problem solving. (Not more than 3 credits may be granted for completion of both ECON  100 and ECON  150 at Hawaiʻi Community College.) (Attributes: DS),100,ECON,Intro To Economics,Economics,141565,{},3
How individual prices are determined. Efficient consumer-producer decision making. Pre: One MATH course numbered 125 or higher (any one of which can be taken concurrently); or instructor's consent. (Attributes: DS),130,ECON,Intro To Microeconomics,Economics,141565,{},3
"The functioning of economic systems with emphasis on the forces determining levels of, and changes in, national income, employment and the price level. (Attributes: DS, GQ)",131,ECON,Intro To Macroeconomics,Economics,141565,{},3
"Determination of income, employment, price levels; fiscal and monetary policies.  Pre:  ECON  131.",300,ECON,Inter Macroecon Theory,Economics,141565,{},3
"Price determination under monopoly, oligopoly, and competition. Analysis of demand and cost. Pre: ECON  130, One MATH course numbered 125 or higher.",301,ECON,Inter Microecon Theory,Economics,141565,{},3
"Application of economic and statistical concepts for business decisions. Subjects cover projection of demand and production, case analysis, problems of forecasting, multifactors and multiproducts, technological change: capital budgeting, input-output analysis, and programming techniques. Pre: ECON  130.",302,ECON,Managerial Economics,Economics,141565,{},3
"Analysis of growth, structural change, development patterns, foreign investment, foreign trade, and development policies and strategies; emphasis on Far East and South Pacific Islands.  Pre: ECON  130, 131. (Attributes: GAHP)",310,ECON,Economic Development,Economics,141565,{},3
"Relation of monetary system to price level, employment and income; nature and functions of money and banking; role of money in international trade and inflation.  Pre: ECON  131. (Attributes: DS, GQ, GS)",340,ECON,Money &amp; Banking,Economics,141565,{},3
"Balance of payments, foreign exchange rate policies, and their impact on domestic employment, inflation, internal and external balances, and other related topics. Pre: ECON  131",361,ECON,International Finance,Economics,141565,{},3
"An explicit introduction to the behavior and objectives of government in the economic system. Analysis focuses on the rationale of nonmarket institutions and on the two groups of agents that operate government, the politicians and the bureaucrats, as these agents allocate expenditures for government activities. Pre: ECON  130",370,ECON,Government Finance,Economics,141565,{},3
"Use of mathematical and statistical techniques to model and test the reality of economic theory, tests of hypotheses and forecasting. Pre: MATH  115 or QBA  260.",390,ECON,Econometrics,Economics,141565,{},3
"Game theory is a mathematical tool used in a variety of fields such as economics, political science, law, sociology, biology, and computer science.  The purpose of this course is to introduce to game theory and to explore its applications. Topics include but not limited to, deterrence, crisis bargaining, people, war, and terrorism. Pre: ECON  130",414,ECON,Global Topics in Game Theory,Economics,141565,{},3
"This course applies economic theory to examine the production of health. Issues such as asymmetric information, externalities, and indirect or third party payment are examined. The use of cost/benefit analysis, and reimbursement of expenses on healthcare organizations will be discussed. Pre: ECON  130",417,ECON,Health Economics,Economics,141565,{},3
"Introductory level of forecasting for business and economics with an emphasis on Hilo and Hawaiʻi economies and businesses.  Topics include time series techniques, linear regression forecasts, several miscellaneous forecasting models, and forecasting evaluation. Pre: QBA  260 or MATH  115 or instructor's consent.",430,ECON,Quantitative Forecasting,Economics,141565,{},3
"An analytical framework for examining the relationships among environmental quality, natural resource use, and economic and political systems; analysis of circumstances that give rise to environmental problems, resource use conflicts, and possible policy solutions to these problems and conflicts. The course will emphasize issues pertaining to Hawaiʻi, especially sustainable development and climate change. This course is dual listed with CBES  682. Pre: ECON  130",482,ECON,Natural Resource Env Eco,Economics,141565,{},3
"Designed to guide students in exploring various career pathways in education and related fields. The seminar will provide students with insights into educational roles, necessary qualifications, and skill development, as well as opportunities for networking and professional growth.",201,ED,BAES Sem: Career Explorations,Education,141565,{},3
"This course is an introduction to education with an emphasis on the following topics:  the teaching profession, the analysis of reasons for entering teaching and factors that influence these reasons; the characteristics of the present teaching force; complexities of teaching; the current trends and issues in education; and the role of the school within the community.  Student will be provided an opportunity for voluntary field experience totaling 10 hours. (Attributes: ALEX, DS, GCC)",210,ED,Introduction to Teaching,Education,141565,{},3
"Basic knowledge and skills designed to foster mathematics teaching in the elementary classroom. Includes major mathematics concepts, algorithms, procedures, applications, and practices in varied contexts. (Attributes: GQ)",243,ED,Math for Elementary Teachers I,Education,141565,{},3
"After successfully completing this course, you will be able to be a peer wellness coach and educator. Grounded in Public Health and developmental science, students will learn about perspectives on health and wellness for emerging adults (ages 16-24), the ways in which the sociopolitical context of higher education can facilitate the ease or challenges to student wellbeing. Students will gain skills to create and implement place- based, interactive workshops and informal peer wellness education and coaching, culminating in a wellness symposium, designed and driven by students in the class. (Same as KES  270) (Attributes: GCC)",270,ED,Health and Wellness Education,Education,141565,{},3
Basic knowledge and skills designed to foster the integration of art and music across the elementary curriculum in an educationally sound manner.,272,ED,Art and Music Education,Education,141565,{},3
Introduction to the practice of thinking and the development of intelligence within the complexities of a diverse and transforming society. Historic aspects of education are explored along with philosophical and political movements so students understand education's potential. Critical thinking skills are developed to help students think seriously about education as a potential career. Must be taken for grade. Pre: GPA of 2.5.,310,ED,Foundations of Education,Education,141565,{},3
"Basic knowledge and skills designed to foster the integration of instructional technologies across the curriculum in an educationally sound manner. Includes project-based and place-based learning aligned with ISTE-T standards. Pre: GPA 2.5, earned at least 58 credits, or instructor consent. (Attributes: GAHP)",314,ED,Tech for Learning &amp; Teaching,Education,141565,{},3
"Basic knowledge and skills designed to foster place- based learning in a variety of formal and informal settings. Pre: GPA 2.5, earned at least 58 credits, or instructor consent.",330,ED,Teach/Learn Informal Settings,Education,141565,{},3
"Basic knowledge and skill designed to foster literacy teaching in the elementary schools. Includes foundational knowledge of reading and writing processes. Pre: GPA 2.5, earned at least 58 credits, or instructor consent.",341,ED,Literacy for Elem Teachers,Education,141565,{},3
"Basic knowledge and skills designed to foster science teaching in the elementary classroom. Includes integration of three dimensions of science and engineering practices, cross cutting concepts, and major disciplinary core ideas. Pre: GPA 2.5, earned at least 58 credits, or instructor consent.",342,ED,Science for Elem Teachers,Education,141565,{},3
"Continuation of knowledge and skills designed to foster mathematics teaching in the elementary classroom. Includes major mathematics concepts, algorithms, procedures, applications, and practices in varied contexts. Pre: ED  243, GPA of 2.5, earned at least 58 credits, or instructor consent.",343,ED,Math for Elem Teachers II,Education,141565,{},3
"Basic knowledge and skills designed to foster social studies teaching in the elementary classroom. Includes understandings, capabilities, and practices associated with the central concepts and tools in civics, economics, geography, and history within a framework of informed inquiry. Pre: GPA of 2.5, earned at least 58 credits, or instructor consent.",344,ED,Soc Studies for Elem Teachers,Education,141565,{},3
"This course focuses on children's literature and its impact on social, emotional and intellectual development for elementary school children.  Aesthetic appreciation and creative development will be explored by examining theory and practice about the use of literature with children. Must be taken for a grade. Pre: GPA of 2.5 and junior standing or consent of instructor.",346,ED,Teaching Children's Literature,Education,141565,{},3
"Theories of development focusing on physical, cognitive, social, and emotional development during school-aged years, children (grades K-6) and adolescents (grades 7- 12). Systematic observation and analysis of behavior of school-aged children at home, in the community, and at school. Pre: GPA of 2.5, earned at least 58 credits, or instructor consent.",350,ED,Learner Development,Education,141565,{},3
"What is the relationship between a story and each person who receives it? This course provides an introduction to literature as exploration and reader response theory. An experiential course, students explore how readers engage with story by examining their own reading experiences within a community of learners. Students will further reflect upon their own learning as they imagine how they may teach in the future. The course is designed for anyone who may be considering becoming teachers or would like to deepen their engagement in storytelling and the texts that they read. While the focus is on students interested in middle and high school language arts or the humanities, students thinking about teaching at any level or discipline are welcome.",355,ED,Literature As Exploration,Education,141565,{},3
"This course focuses on exploring the writing skills of adolescents, defined as students in the 6th through 12th grade, and targets pre-MAT students who are interested in becoming secondary teachers. The course will introduce writing curriculum standards and explore instructional strategies that can be used to prepare students in grades 6-12 for writing in college and the workforce. Must be taken for grade. Pre: GPA of 2.5 and junior standing, or instructor's consent.",358,ED,Intro to Adol Writing in Disc,Education,141565,{},3
"Second Language Acquisition for K-12 Educators provides pre and in-service teachers with the latest theory and research on second language acquisition of school age children. The course will examine the relationship between first and second language learning, the role of affective factors, order of acquisition, the concept of interlanguage, comprehending vs. producing the second language, and the role of error correction, providing students the foundations to develop a strong theoretical foundation with regard to second language acquisition and the acute analytical skills required to consider critically such theory in instructional decisions. This course is dual listed with ED  637. Pre: GPA 2.5, junior standing, or instructor consent.",437,ED,Sec Lang Acq K-12 Educators,Education,141565,{},3
"For undergraduate and graduate students interested in improving their ability to communicate their scientific knowledge or research by designing and implementing lesson plans in Hawaii Island schools including formal and informal educational experiences. The course provides the knowledge, skills and dispositions needed to use phenomena in NGSS designed lessons grounded in the uniqueness of Hawaii. Students will observe phenomena that occur in Hawaii’s natural environment and create hands-on, inquiry-based activities to enhance science content knowledge in K-8 learners. Through place-based exploration and experiences student will develop a deeper understanding of the unique values and qualities of Hawaii’s environment, language, values, and culture. Pre: At least 6 credits of 100 level or higher BIOL, CHEM, GEOL, NSCI, PHYS, or MARE courses or instructor approval. This course is dual listed with CBES  642. (Attributes: HPP)",442,ED,Comm Sci in Hawaiʻi Schools,Education,141565,{},3
"Theory and practice for creating and sustaining a culture of connection and belonging in a learning environment grounded in Nā Hopena A’o (HĀ). Pre: GPA of 2.5, junior standing, or instructor consent.",443,ED,Learning Environments,Education,141565,{},3
"Utilizing project-based authentic learning opportunities, students will gain a greater understanding of Place-Based Social-Emotional Learning (PBSEL) and valuable skills they can use to support schools and community organizations on Hawaiʻi Island. Recommended: ED  350 or PSY  320.",444,ED,Place-Based Soc-Emotion Learn,Education,141565,{},3
Students will learn about community-based action research by conducting a study at their internship site that supports schools and community organizations on Hawai’i Island.,445,ED,Community-Based Research,Education,141565,{},3
provides hands on experience with the tools and techniques used to teach robotics and computer programming in K-12 learning environments. There are no prerequisites for this course.,447,ED,Comp Tech &amp; Robotics K-12 Sch,Education,141565,{},3
"Introduction to several traditions of qualitative inquiry. Students are guided (mentored) through experiences where they design, conduct, analyze, and write-up small-scale qualitative studies in educational settings.",448,ED,Qualitative Research,Education,141565,{},3
"Introduction to culture-based education. Integrates Hawaiian history, language, and culture practices for meaningful experiences. Pre: GPA 2.5, earned at least 58 credits, or instructor consent.",450,ED,Learn/Teach in Hawaiʻi Schools,Education,141565,{},3
"Application of literacy concepts, skills, and effective instructional practices for planning, designing, and assessing student learning in the elementary classroom. Pre: Acceptance into the Teacher Licensure track.",451,ED,Literacy Methods,Education,141565,{},3
"Application of social studies and science concepts, skills, and effective instructional practices for planning, designing, and assessing student learning in the elementary classroom. Pre: GPA 2.5, earned at least 58 credits, or instructor consent.",452,ED,Social Studies/Science Methods,Education,141565,{},3
"Application of mathematics concepts, skills, and effective instructional practices for planning, designing, and assessing student learning in the elementary and assessing student learning in the elementary track.",453,ED,Mathematics Methods,Education,141565,{},3
"Exploration and application of differentiated instructional strategies in the inclusive classroom. Includes learner analysis; practical development of activities for differentiated content, processes, and products to assure maximum learning for all students; and assessment. Pre: GPA 2.5, earned at least 58 credits, or instructor consent.",455,ED,Differentiated Instruction,Education,141565,{},3
"Exploration of emerging multilingualism in culturally and linguistically diverse settings. Extends awareness of and skills for trans-languaging and scaffolding multilingualism integration across the curriculum. Includes sheltered instruction and cultural/social influences. Pre: GPA 2.5, junior standing, or instructor consent.",457,ED,Emerging Bilingual Students,Education,141565,{},3
"This course uses interdisciplinary multiple lenses to construct practical, grounded, and equity-based approaches to gain understanding of how migration impacts children and youth and the critical role of the education on their adaptation.",460,ED,Children of Migration,Education,141565,{},3
"Exploration of emerging multilingualism in culturally and linguistically diverse settings. Extends awareness of and skills for trans-languaging and scaffolding multilingualism integration across the curriculum. Includes sheltered instruction and cultural/social influences. This course is dual listed with ED  667. Pre: GPA 2.5, junior standing, or instructor consent. Previously offered as ED  457. (Attributes: GCC, HPP)",467,ED,Emerging Bilingual Students,Education,141565,{},3
Overview of professional attributes and licensure standards. Professional growth and development through field experiences in local K-6 schools. Pre: Acceptance into the Teacher Licensure track.,470,ED,Professional Dispositions,Education,141565,{},1
"Introduction to the Model Code of Ethics for Educators (MCEE) as a guide to standards of ethical professional practice. Participation in collaborative discussions around ethical dilemmas, using awareness and understanding of the MCEE to support ethical decision- making. Pre: Acceptance into the Teacher Licensure track and successful completion of ED  470 and ED  480.",471,ED,Ethics for Educators,Education,141565,{},1
"Continued professional development through clinical practice, participation in workshops, training, and presentations in preparation for state licensure and employment in the profession. Pre: Acceptance in the Teacher Licensure track and successful completion of ED  471 and ED  481.",472,ED,Professional Responsibility,Education,141565,{},1
"Practical application of theories of learner development, learning environments, learner differences, and instructional planning in local K-6 schools. Introduction to school learning communities. Must be taken CR/NC. Pre: Acceptance into the Teacher Licensure track.",480,ED,Field Experiences I,Education,141565,{},1
Participation and collaboration in a learning environment for reflective self-study and professional learning while student teaching. Pre: Acceptance into the Teacher Licensure track and successful completion of ED  471 and ED  481.,490,ED,Teaching Seminar,Education,141565,{},3
"Completion of reflective-inquiry project from the first field practicum. Pre: GPA 2.5, senior standing, successful completion of ED  485 or instructor consent.",491,ED,Capstone I,Education,141565,{},3
"Completion of senior capstone project. Pre: GPA 2.5, senior standing, successful completion of ED  486, or instructor consent.",492,ED,Capstone II,Education,141565,{},3
"Professional development and exploration of career pathways in a variety of education settings. Examination of professional ethics when working with children and youth, professional preparation, and career planning. Pre: GPA 2.5, senior standing, and successful completion of ED  485, ED  486, and ED  491.",493,ED,Professional Pathways,Education,141565,{},3
"psychological learning characteristics, heritage, identity Teacher leader focused course. Survey of social- problems of Hawaiʻi ethnic groups, study of prejudice and inter-ethnic hostilities as related to education and teaching. Includes improving outreach and collaboration with families and community.",600,ED,Ed Of Ethnic Groups in Hawaii,Education,141565,{},3
"utilization of instructional materials for systematic Teacher leader focused course. Selection, evaluation and achievement of curriculum goals; investigation of innovative and students. Pre: acceptance into the M.Ed. program or Promoting/facilitating improvements in learning for teachers technological advances for use in teaching and training. consent of instructor.",602,ED,Technology in Education,Education,141565,{},3
"Systematic study of the purposes of educational research, evaluation and use of research, and introduction of research design principles with emphasis on classroom applications. Pre: acceptance into the M.Ed. program or consent of instructor.",608A,ED,Action Research I,Education,141565,{},3
Advanced academic study and writing processes for analyzing and evaluating current educational research articles. A synthesis and application of research skills which culminates in an original research proposal. Pre: ED  608A or instructor's consent.,608B,ED,Action Research II,Education,141565,{},3
Principles of research methodology and analysis as applied to field research. Pre: ED  608A and B or consent of instructor.,608C,ED,Action Research III,Education,141565,{},3
"history of education. Historical and contemporary Teacher leader focused course. Social and intellectual relationships between schools and society. Foundations of the major philosophies of education. Contemporary educational theory and practice as related to major historical, philosophical and social factors in American profession. Pre: acceptance into the M.ED. program or culture. Includes advocating for student learning and the instructor's consent.",610,ED,Foundations Of Education,Education,141565,{},3
"Foundations of educational psychology through the vehicle of an exploratory study. Inquiry approach stresses learning theory, measurement techniques, and research skills in education. Pre: acceptance into the M.Ed. program or instructor's consent.",611,ED,Adv Educ Psychology,Education,141565,{},3
"Advanced academic study and writing processes for analyzing and evaluating current educational research articles, literature reviews and graduate student publications.  Development of scholarly educational research skills with a focus in content area discipline. Investigation of theoretical and methodological issues of research.  Pre:  acceptance into the M.Ed. program or instructor's consent.",612,ED,Literature Review in Education,Education,141565,{},3
"Teacher leader focused course. systematic study of the theory of measurement, assessment and evaluation in educational settings. Promotes the use of assessments for classroom and school improvements. Pre: acceptance into the M.Ed. program or consent of instructor",616,ED,Assess &amp; Evaluation in Ed,Education,141565,{},3
"conceptual framework of inclusive education which consists Teacher leader focused course. Systematic study of the of special education, gifted and talented education and compensatory programs. Emphasis will be placed upon individual student characteristics and strategies for Pre: acceptance into the M.Ed. program or consent of development and building strong home/school connections. effective instruction. Focuses on continuous professional instructor",620,ED,Indiv Differences: Learner,Education,141565,{},3
of curriculum. Explanation of contemporary curricular issues Teacher leader focused course. Development and improvement which impact teaching and learning in the classroom. Emphasis on school reform and renewal. Pre: acceptance into the M.Ed. program or instructor's consent,622,ED,School Curriculum,Education,141565,{},3
Teacher leader focused course. A critial examination of newest trends in instruction. Bridges the gap between academic research and classroom implementation. Pre: acceptance into the M.Ed. program or instructor's consent.,635,ED,Adv Instructional Strategies,Education,141565,{},3
"Provides pre and in-service teachers with the latest theory and research on second language acquisition of school age children. The course will examine the relationship between first and second language learning, the role of affective factors, order of acquisition, the concept of interlanguage, comprehending vs. producing the second language, and the role of error correction, providing students the foundations to develop a strong theoretical foundation with regard to second language acquisition and the acute analytical skills required to consider critically such theory in instructional decisions. This course is dual listed with ED  437.",637,ED,SLA for K-12 Teachers,Education,141565,{},3
"Introduction to theories of learner development, including cognitive, linguistic, emotional, personality, and moral/ prosocial development of students (grades K-12). Exploration of developmentally appropriate and challenging learning experiences. Pre: Admission to MAT program.",640,ED,Learner Development,Education,141565,{},2
"Introduction to legislation for students with disabilities. An overview of areas of exceptionality, the basic principles and practices of inclusive instruction, and how to address the special needs of diverse learners. Pre: Admission to the MAT program and ED  640.",641,ED,Learning Differences,Education,141565,{},3
