course_desc,course_number,course_prefix,course_title,dept_name,inst_ipeds,metadata,num_units
"Supervised on-the-job experience in the business community in an accounting-related capacity. Comprehensive report by students, meeting with faculty advisor, and performance evaluation from employer required. Pre: Instructor's Consent. (Attributes: GCC)",200,ACC,Accounting Internship,Accounting,141565,{},3
"An introduction to accounting principles and practices used to record and communicate financial information. Analyze methods for valuing assets, liabilities, and equity of an organization. Pre: 15 or more credits at the college level.",201,ACC,Intro to Financial Accounting,Accounting,141565,{},3
"An introduction to managerial accounting methods for evaluating performance including cost accounting, budgeting, break-even analysis, standard cost systems and reporting for internal decision making.  Pre:  ACC  201.",202,ACC,Intro to Managerial Accounting,Accounting,141565,{},3
The accounting process and the application of generally accepted accounting principles to assets and liabilities. Emphasis upon accounting theory.  Pre: ACC  202; successful completion of 45 college credits.,350,ACC,Intermediate Acc I,Accounting,141565,{},3
"The application of generally accepted accounting principles to accounting for owner's equity, long-term investments and debt, funds flow, and financial statement analysis. Pre: C or better in ACC  350.",351,ACC,Intermediate Acc II,Accounting,141565,{},3
"Principles and practices involved in the determination of federal income taxation and tax planning as it applies to individuals and businesses including the concept of gross income, exclusions, deductions, credits, property transactions and sole proprietorships. Pre: C or better in ACC  202, ACC  350, and ACC  351.",352,ACC,Individual &amp; Business Taxation,Accounting,141565,{},3
"Cost accounting system output relevant to managerial decision making, planning and control. Topics include job order and process costing, direct and standard cost systems, with emphasis on application and analysis of cost. Pre: C or better in ACC  202, ACC  350, and ACC  351.",353,ACC,Cost Accounting,Accounting,141565,{},3
"Practical applications of general ledger/bookkeeping for small businesses.  Focus will be on basic Accounting Information Systems concepts, internal controls, accounting tasks, and comparative product analysis.  Pre: C or better in ACC  202; C or better or concurrent enrollment in ACC  350; successful completion of 45 college credits.",354,ACC,Business Software,Accounting,141565,{},3
"Advanced topics in taxation at the discretion of the instructor.  Topics might include tax planning for individual and business owners, estate planning, gift taxes, or other current topics in taxation.  Pre: C or better ACC  352.",355,ACC,Advanced Topics in Taxation,Accounting,141565,{},3
"Accounting principles as applied to nonprofit organizations, including government.  Emphasis on budgetary control and fund accounting.  Pre: C or better in ACC  350.",358,ACC,Governmental Accounting,Accounting,141565,{},3
"The application of generally accepted accounting principles to specialized accounting entities:  partnerships, branches, affiliated companies, estates and trusts; and to special topics including consolidations.  Pre: ACC  351.",450,ACC,Advanced Accounting,Accounting,141565,{},3
"Auditing concepts including standards, objectives, and ethics for external auditors.  Emphasis on reporting standards, internal control, evidence, and statistical sampling.  Pre: C or better in ACC  351.",454,ACC,Auditing,Accounting,141565,{},3
"Audits of accounting information systems, including enterprise systems.   Generally accepted IT audit standards, frameworks, tools and methods.  Includes the study and use of computer-assisted audit tools and techniques (CAATTS).  Pre: ACC  454.",455,ACC,IT Audit,Accounting,141565,{},3
This is a case-based auditing course that expands on topics introduced in Audit (ACC  454).  The primary focus of this course is Fraud Examination and Forensic Accounting. Students will examine cases involving current and classic frauds as well as learning the requirements for collecting evidence for court. Pre: ACC  454.,456,ACC,Advanced Auditing,Accounting,141565,{},3
"The core principles of aircraft flight are examined. Students become familiar with airfoils, wings, different flight profiles and atmospheric effects on aircraft performance. Students will develop and analyze simulations of airfoils and wings.",151,AERS,Introduction to Aerodynamics,Aeronautical Sciences,141565,{},3
"Survey of unmanned aircraft systems (UAS) emphasizing the commercial history including sections on hobby and military applications. Students learn operational principles, laws, and theory.",152,AERS,Introduction to UAS,Aeronautical Sciences,141565,{},3
"Introduces the airplane to entry-level student pilots as they prepare for flight training. Stresses airport systems, air traffic control procedures, aviation weather, air navigation, radio communication procedures, and Federal Aviation Regulations. Covers airplane ground and flight operations, take-off and landing, basic flight maneuvers, cross country methods and emergency procedures. Prepares students for the required FAA Private Pilot Airplane Knowledge Test and Private Pilot Airplane Practical Test. To be taught offsite at flight provider. Offered as CR/NC only. Pre: Approval of AERS Program.",201,AERS,Private Pilot I,Aeronautical Sciences,141565,{},5
"Introduces cross-country navigation, emergency operations, takeoffs, landings and go-arounds in solo flight. Prepares students for the FAA Private Pilot Checkride. To be taught offsite at flight provider. Offered as CR/NC only. PRE: Approval of AERS Program.",202,AERS,Private Pilot II,Aeronautical Sciences,141565,{},5
"Covers Air Traffic Control Clearances, GPS Flight Plan Function. Perform straight-and-level flight, constant rate climbs and descents, constant airspeed climbs and descents, standard rate turns. Compliance with departure, en route and arrival procedures. To be taught offsite at flight provider. Offered as CR/NC only. PRE: Approval of AERS Program.",203,AERS,Cross Country Single Eng PIC,Aeronautical Sciences,141565,{},5
"This course focuses on the overview of Multi-Engine operations, students will continue their aeronautical knowledge training and perform simulation training specific to multi-engine aircraft. Pre: AERS  102",220,AERS,Multi-Engine Operations I,Aeronautical Sciences,141565,{},3
"This course focuses on Commercial Pilot and Multi- Engine operations including calculating performance data, common errors, computing takeoff and landing data and computing weight and balance calculations. Pre: AERS  220",221,AERS,Multi-Engine Operations II,Aeronautical Sciences,141565,{},3
"Develop an attitude and philosophy for accident prevention and an awareness of major flight security issues. Though the focus is on accident prevention, aircraft accident investigation is illustrated to include: human factors, mechanical considerations, and the nature of accident/error chains. Pre: AERS  102 or Instructor's Consent.",250,AERS,Aviation Safety,Aeronautical Sciences,141565,{},3
"Discusses atmospheric science principles applicable to flight. Students gain a general understanding of meteorological theory and learn how to read applicable charts, graphics, and generated reports. Describes local meteorological phenomenon applicable to air travel. Pre: AERS  102 or Instructor's Consent",251,AERS,Aviation Weather,Aeronautical Sciences,141565,{},3
"This course is comprehensive study of aircraft systems and components at the technical level. Areas of study include aircraft electrical, hydraulic, fuel, propeller and auxiliary systems including theory of operation, calculations, and related Federal Aviation Regulations. Pre: AERS  251, PHYS  151 which may be taken concurrently.",260,AERS,Aircraft Systems &amp; Instruments,Aeronautical Sciences,141565,{},3
"Survey of national and international laws and regulations regarding aircraft operation and ownership, contracts, liability and enforcement. Course activities include case reading, argument, and legal research. Pre: AERS  101",301,AERS,Aviation Laws and Regulations,Aeronautical Sciences,141565,{},3
"Flight course on basic Instrument flight maneuvers including Instrument turns, stalls, unusual attitude recoveries. Performs basic Instrument flight patterns. Uses VOR and GPS navigation. To be taught offsite at flight provider. Offered as CR/NC only. PRE: Approval of AERS Program.",310,AERS,Instrument Basic,Aeronautical Sciences,141565,{},3
"Advanced Instrument flight. Perform VOR and localized approaches, GPS approaches, circling approach, DME Arc approach and missed approach procedures. Lost comms procedures, engine failure in IMC and partial panel covered. To be taught offsite at flight provider. Offered as CR/NC only. PRE: Approval of AERS Program.",311,AERS,Instrument Advanced,Aeronautical Sciences,141565,{},3
"Instruction on Steep turns, Chandelles, Lazy Eights and Eights on Pylons covered. Review of FAA Guidelines. Pre: AERS  221 or Instructor's Consent",340,AERS,Advanced Simulated Maneuvers,Aeronautical Sciences,141565,{},1
"Students gain experience in planning and execution of UAS missions. Computer simulation is leveraged to provide real-time mission experience. Students will practice the roles of pilot in command, payload operator, and mission commander. Pre: AERS  152",352,AERS,UAS Mission Plans &amp; Simulation,Aeronautical Sciences,141565,{},3
"The core technologies of unmanned aircraft systems are examined. Students become familiar with UAS at the component level. Working in teams students will build a UAS, choose and retrofit a payload, and program the control software.",354,AERS,UAS Robotics,Aeronautical Sciences,141565,{},3
"Domestic and International navigation, planning, procedures, and techniques. Provides basic understanding of IFR domestic and international flights and gives students a fundamental knowledge of international contingency planning and emergency procedures. Pre: AERS  251 and MATH  140 or Instructor's Consent",355,AERS,Domestic &amp; International Nav,Aeronautical Sciences,141565,{},3
Pre-departure orientation course for students continuing on to flight school. Review concepts and simulation maneuvers taught in previous courses as well as discuss common issues encountered by students attending flight school and how to mitigate them. Pre: AERS  260,370,AERS,Prep for Single/Multi Eng Flt,Aeronautical Sciences,141565,{},1
"History and development of current industry CRM training programs is reviewed. Students learn to recognize crew errors, demonstrate the ability to mitigate the error consequences, and to function as an effective member of a professional flight crew. Pre: AERS  251",387,AERS,Crew Resource Management,Aeronautical Sciences,141565,{},3
"Concepts in Crew Resource Management relating to responsibility and authority of the Pilot in Command, crew member roles, conflict management, flight operation procedures, in-flight hazards and emergency procedures. To be taught offsite at flight provider. Offered as CR/NC only. PRE: Approval of AERS Program.",388,AERS,Crew Resource Mgt &amp; Crew Ops,Aeronautical Sciences,141565,{},2
Flight course covering multi-engine aerodynamics and maneuvering with one engine inoperative. FAA Commercial Pilot Airplane exam and FAA Commercial Multi-Engine checkride. To be taught offsite at flight provider. Offered as CR/NC only. PRE: Approval of AERS Program.,420,AERS,Commercial Cert Multi-Engine,Aeronautical Sciences,141565,{},5
"Advanced knowledge of single-engine systems and characteristics, aerodynamics. Engine failure operations and procedures. Commercial single-engine checkride. To be taught offsite at flight provider. Offered as CR/NC only. PRE: Approval of AERS Program.",421,AERS,Commercial Single Eng Add-on,Aeronautical Sciences,141565,{},2
"This course will guide new pilots to safely operate rotor- wing and fixed-wing unmanned aircraft systems (UAS). This course includes essentials of risk mitigation and accident prevention, teamwork and Crew Resource Management (CRM), and focuses on data recovery. Pre: AERS  354",452,AERS,UAS Flight,Aeronautical Sciences,141565,{},3
"Discusses major air carrier organizational structure and relationships of operations with marketing, maintenance and safety. Provides students with current airline transport pilot operational policies and procedures and discusses their relationship to other departments within the total airline corporate structure. Pre: AERS  387",471,AERS,Airline Operations,Aeronautical Sciences,141565,{},1
"Develop career goals, objectives, and gain an understanding of the career pilot hiring process. Research the industry an potential employers using available resources. This course will reinforce the prospective graduates skills necessary to develop effective interviewing, letter and resume-writing skills. Pre: AERS  387",472,AERS,Pilot Professional Development,Aeronautical Sciences,141565,{},1
"Leadership techniques that pilots need to succeed in their careers. Topics covered will include leadership theory and dynamics, problem solving, and communication strategies. Pre: AERS  387",473,AERS,Leadership as a Pilot,Aeronautical Sciences,141565,{},1
Careers in aeronautical science are not limited to pilots. Pilots should not limit their training to flying alone. This course offers the opportunity for interns to reflect on knowledge gained in volunteer service. Wisdom is shared with other students. Pre: AERS  387 or Instructor's Consent.,495,AERS,Professional Seminar,Aeronautical Sciences,141565,{},3
"Introduction to diverse disciplines of agricultural sciences, industry, and contemporary issues in agriculture. (Attributes: FGB)",100,AG,Intro to Agricultural Sciences,Agriculture,141565,{},3
"This writing intensive and communications course will consist of short lectures to demonstrate types of scientific writing and speaking by comparison of types of writing, presentations by invited speakers to demonstrate different speaking styles, and library and online research to develop a coherent, well-written scientific review consisting of a short, five page paper to be handed in and presented in class using Power Point.",200,AG,Agro-Environmental Science Com,Agriculture,141565,{},3
"An overview of the production aspects of microbiology, including fermentation biology, mushroom cultivation, and biotechnology. Pre: BIOL  171 or instructor consent.",304,AG,Applied Microbiology,Agriculture,141565,{},3
"An introduction to the principles and methods of genetic studies.  The principles are first covered, especially with regard to crop improvement.  This is followed by an overview of the structure and function of DNA and RNA, and an introduction to the tools and applications of molecular biology. Pre: BIOL  171",375,AG,Intro To Genetic Analysis,Agriculture,141565,{},3
"This course is an overview of modern agricultural biotechnology with an emphasis on contemporary case studies.  It is geared toward students, teachers, and extension personnel with an interest in this field.  Thus, it will include instructional methods and alignment to state DOE standards.  A firm grasp of biology and some understanding of genetics is assumed.  Pre: BIOL  171 or instructor consent.",403,AG,Ag Biotechnology for Educators,Agriculture,141565,{},3
"This course will provide basic information about agricultural biotechnology, with examples of its uses. Topics will include overviews of gene and genome analysis, transgenic technology, and bioinformatics, with an emphasis on crop improvement. Pre: at least 1 biology course.",405,AG,Agricultural Biotechnology,Agriculture,141565,{},3
Guided research into current problems.  Topics may vary according to interest of students and instructor. CR/NC only.,496,AG,Prof Develop for the Sciences,Agriculture,141565,{},1
"Agribusiness and agrieconomic functions performed by specialized agricultural agencies with emphasis on physical operating patterns;  field trips to production, marketing and finance firms;  workshops with agribusiness managers.",120,AGBU,Ag Bus Field Study,Agribusiness,141565,{},1–3
"Organization forms and management functions of agribusiness firms, management science principles, inventory control, operation research techniques, decision model, and human resources development as they are related to agribusiness firms.",320,AGBU,Agribus Management,Agribusiness,141565,{},3
"Primary marketing research including problem, definition, hypothesis formulation, research design, data collection, and results analysis.  Mechanics of writing technical reports and oral presentations.  Pre:  AGEC  201 or ECON  130.",340,AGBU,Agri-Marketing Research,Agribusiness,141565,{},3
"This course focuses on the management, financial, and marketing functions of agribusiness firms with special emphasis on sustainable island food and energy systems, indigenous rural production and land resource management models for islands, including the Hawaiian ahupua‘a and Japanese Satoyama. Junior or Senior Status Recommended.",450,AGBU,Sust Agribus Island Food Syst,Agribusiness,141565,{},3
Introduction to agriculture and resource economics and agri-business with application to Hawaiian agriculture (Micro-economics).,201,AGEC,Agri Economics,Agricultural Economics,141565,{},3
"Acquaints the student with the economic organization and operation of the food and fiber section of the U.S. and Hawaiian economy.  In two general parts, one provides a treatment of agricultural price analysis; the second examines the marketing system for agricultural inputs, farm products, and processing and distribution activities with emphasis on cooperative marketing.  Field trips to cooperative and other marketing firms.  Future trading. Pre: introductory course in economics or agricultural economics.",322,AGEC,Marketing Ag Products,Agricultural Economics,141565,{},3
Introduction to core concepts and technologies of bioeconomy applications in the tropics with comparisons to temperate regions. Emphasis will be placed on the prospects of tropical plant biomass and algae to serve as renewable raw materials for a sustainable economy.,360,AGEC,Tropical Bioeconomy,Agricultural Economics,141565,{},3
"Provides the student with an understanding of economic growth, resource scarcity and policy, environmental degradation, economic policy, property right and income distribution, institutional framework, benefit cost analysis and application of natural resource management in Hawaiʻi.",380,AGEC,Environ Pol &amp; Mgt Hawn Nat Res,Agricultural Economics,141565,{},3
"The principles of plant competition and succession during the establishment and maintenance of herbaceous species and communities are related to soil, biotic, and microclimate factors and their interactions.  Ecological and nutritional principles embodying plant and animal factors in the utilization of herbaceous plants by livestock are established.  Research methodology in grassland systems also is presented.  Pre:  ANSC  141, BIOL  171 or HORT  262, or instructor's consent.",410,AGRN,Soil-Plant Herbivore Interrltn,Agronomy,141565,{},3
"This course focuses on history, philosophy, and language of the criminal justice system.  The role of law enforcement, prosecutor, public defender, courts, and corrections is examined.  Social aspects of change and how it affects the criminal justice system also explored. Pre:  Placement in ENG  100.  Offered in conjunction with Hawaiʻi Community College. (Attributes: DS)",101,AJ,Intro to Admin of Justice,Administration of Justice,141565,{},3
"This is an introductory course in criminal investigations. The nature of investigations, fingerprint classification, the role of the laboratory, and specific offense investigation will be explored.  The class will also discuss interview and interrogation and search and seizure techniques.  Pre:  Placement in ENG  100.  Offered in conjunction with Hawaiʻi Community College.",103,AJ,Criminal Investigations I,Administration of Justice,141565,{},3
"Advanced course work in forensic science (Legal Scientific Investigation), with its contributions to both Crime Scene Investigations and Laboratory Analysis. Specific field and laboratory investigative techniques in violent crimes and other major felonies will be explored. Pre:  AJ  103.  Offered in conjunction with Hawaiʻi Community College.",104,AJ,CSI: Violent Crime Forensics,Administration of Justice,141565,{},3
"This course examines the history of punishment and corrections.  The class discusses laws, records, inmate classification, treatment programs, disciplinary procedures and supervisory techniques.  Offered in conjunction with Hawaiʻi Community College.",150,AJ,The Correctional Process,Administration of Justice,141565,{},3
"This course surveys the concepts and issues in the administration of security.  Defines public versus private security roles for retail business, industry, and governmental agencies.  Provides an overview of the functions of various security activities.  Pre:  placement in ENG  100.  Offered in conjunction with Hawaiʻi Community College.",170,AJ,Intro to Private Security,Administration of Justice,141565,{},3
"An examination of the history of terrorism, focusing on the terrorists, who they are, and how they operate.  Responses to domestic and international terrorism will be discussed along with analyzing future trends.  Pre:  AJ  101. Offered in conjunction with Hawaiʻi Community College.",180,AJ,Intro to Homeland Security,Administration of Justice,141565,{},3
"This course explores crime and the body of knowledge regarding it as a social phenomenon.  An emphasis is placed on the analysis of crime, crime causation, crime variables, impact on society, and societal reactions to crime.  Pre:  placement in ENG  100. Offered in conjunction with Hawaiʻi Community College.",208,AJ,Criminology,Administration of Justice,141565,{},3
"This course focuses on principles and procedures of arrest, detention, petition, summons, records, and adjudication of the juvenile offender.  It introduces the organization and function of the police juvenile unit, community diversion practices and organization of the Family court. Pre:  placement in ENG  100.  Offered in conjunction with Hawaiʻi Community College.",210,AJ,Juvenile Justice,Administration of Justice,141565,{},3
"The U.S. Constitution is examined as a basis of arrest, search, seizure, interrogation, use of force and civil rights.  U.S. Supreme Court cases and Hawaiʻi Court cases are examined to illustrate the court's interpretive process. Pre:  AJ  101.  Offered in conjunction with Hawaiʻi Community College.",220,AJ,Constitutional Law,Administration of Justice,141565,{},3
"Studies history and philosophy of criminal law.  Examines United States Constitution, especially the Bill of Rights. Considers nature of law, legal institutions, criminal court procedures, and offenses against persons and property. Includes case briefs. Pre:  AJ  101.  Offered in conjunction with Hawaiʻi Community College.",221,AJ,Criminal Law,Administration of Justice,141565,{},3
"This course studies the principles of organization and administration of policing.  Overviews of operations and activities of various divisions, bureaus, training and selection procedures, planning, and research are discussed.  Pre:  placement in ENG  100.  Offered in conjunction with Hawaiʻi Community College.",233,AJ,Police Organization &amp; Mgmt,Administration of Justice,141565,{},3
This course acquaints the student with the role of police in government and the critical importance of effective community relations.  The dynamics of race relations and other current social problems that directly relate to the law enforcement community are explored. Pre:  placement in ENG  100.  Offered in conjunction with Hawaiʻi Community College.,234,AJ,Police and Community Relations,Administration of Justice,141565,{},3
"This course will provide students with the basic training skills necessary to enhance their opportunities to secure a job in the high demand field of corrections. The course will focus on such areas as the history and philosophy of corrections, the role of the correctional officer, legal aspects of corrections, communication and writing skills, as well as basic security procedures. Pre:  AJ  101 and AJ  150.  Offered in conjunction with Hawaiʻi Community College.",250,AJ,Practice/Proced in Corrections,Administration of Justice,141565,{},3
"This course focuses on domestic violence and child abuse.  The cycle of violence, causes, effects and symptoms of child abuse will be explored.  Legal, public policy, criminal justice, health and social services responses and interventions to family, child and intimate partner abuse will be examined.  Pre:  placement in ENG  100. Offered in conjunction with Hawaiʻi Community College.",256,AJ,Domest Violence &amp; Child Abuse,Administration of Justice,141565,{},3
"Examination of recent textual materials, government reports, and problems within the criminal justice system and how it affects change within American society and the world.  Includes preparation of a formal research essay.  Pre:  AJ  101 and ENG  100.  Offered in conjunction with Hawaiʻi Community College.",280,AJ,Current Issues,Administration of Justice,141565,{},3
"The identification of narcotics and dangerous drugs, their manufacture and distribution, effects on society, applicable Federal and state laws.  Vice and organized crime investigations, applicable laws, effects on individuals and society.  Pre:  ENG  100/100T, ESL  100/100T, or concurrent enrollment.  Offered in conjunction with Hawaiʻi Community College.",285,AJ,Narcotics &amp; Organized Crime,Administration of Justice,141565,{},3
