course_desc,course_number,course_prefix,course_title,dept_name,inst_ipeds,metadata,num_units
"This course is designed for students to understand health in the broadest sense of the word -- as an integrated process for discovering, using, and protecting all possible resources within the individual, 'ohana, community, and environment.",202,KES,Health Promotion,Kinesiology and Exercise Sciences,141565,{},3
"Nature, scope, aim and objectives of physical education; basic principles of human movement; physical education as academic discipline and its relationship to fields such as recreation, health education, and athletics.",203,KES,Intro to Physical Education,Kinesiology and Exercise Sciences,141565,{},2
"Nature, responsibilities, personal and professional requirements of a coach. Scientific principles applicable to coaching methodology and athletic competition.",204,KES,Intro to Coaching Athletics,Kinesiology and Exercise Sciences,141565,{},2
"Fundamental principles of normal nutrition and the importance of nutrition in promoting growth and health. (Attributes: DB, GN)",207,KES,Basic Human Nutrition,Kinesiology and Exercise Sciences,141565,{},3
"This course focuses on the data management and the basic statistics in exercise sciences.  Content includes research methods and designs, data collection, organization and management, descriptive and inferential statistics, central tendency, variability, correlation, regression, t-tests, analysis of variance and various nonparametric tests. Computerized statistical analyses are embedded throughout the course.",209,KES,Data and Stats in Kinesiology,Kinesiology and Exercise Sciences,141565,{},3
"Introduction to professions available for individuals graduating with a Kinesiology and Exercise Sciences degree (e.g. Public Health and Health Promotion, Sports Psychology, Strength and Conditioning Specialist, Kinesiologist, Exercise Physiologist, and various allied health professions Athletic Training, Physical Therapy, etc). This course serves as helpful tool in providing students with the information necessary to pursue a degree/focus program within Kinesiology and Exercise Sciences. KES program focuses, degree expectations, course maps, and advising will be provided; emerging evidence-based topics will be discussed.",210,KES,Introduction to KES,Kinesiology and Exercise Sciences,141565,{},3
"This course provides a thorough guide of human anatomy and its application to human movement through an in- depth evaluation tissues (bones (joints), muscle, nerve, and connective tissue) during motor activities. (Attributes: DB)",212,KES,Anatomical Kinesiology,Kinesiology and Exercise Sciences,141565,{},3
"This course explores the effects of microgravity and spaceflight on the physiology of passengers.  Topics addressed in this course include space travel effects on: the skeletal system; the muscular system; the cardiovascular and cardiorespiratory systems; and the neurovestibular system.  Effects of radiation exposure, psychosocial issues in spaceflight, and medical risks and preventions will be presented in this course.",224,KES,Human Physiology &amp; Spaceflight,Kinesiology and Exercise Sciences,141565,{},3
"An introduction to public health practice and history, with focus on principles and tools for population health, disease prevention, health promotion, health professions and healthcare systems. (Attributes: DS)",250,KES,Foundation of Public Health,Kinesiology and Exercise Sciences,141565,{},3
"This course will cover basic human anatomy, physiology and chemistry of cells, organelles, cell division, metabolism, genetics, tissues, the integumentum, bone and muscle tissue.  Each subject is presented with the emphasis on its response to activity and exercise.",260,KES,Exercise Science Anat &amp; Phys I,Kinesiology and Exercise Sciences,141565,{},3
"This course is a continuation of Exercise Sciences Anatomy and Physiology I.  The course will cover basic human anatomy and physiology of the endocrine, circulatory, lymphatic, respiratory, digestive, urinary and reproductive systems.  Each subject is presented with the emphasis on its response to activity and exercise.  Pre: KES  260.",261,KES,Exercise Science Anat &amp; Phy II,Kinesiology and Exercise Sciences,141565,{},3
"The organization, administration, and supervision of intramural sports programs in schools with emphasis on leadership, program content, facilities, scheduling, rules and regulations, promotion, financing, and evaluation.",263,KES,Intramural Athletics,Kinesiology and Exercise Sciences,141565,{},2
"After successfully completing this course, you will be able to be a peer wellness coach and educator. Grounded in Public Health and developmental science, students will learn about perspectives on health and wellness for emerging adults (ages 16-24), the ways in which the sociopolitical context of higher education can facilitate the ease or challenges to student wellbeing. Students will gain skills to create and implement place- based, interactive workshops and informal peer wellness education and coaching, culminating in a wellness symposium, designed and driven by students in the class. (Same as ED  270) (Attributes: GCC)",270,KES,Health and Wellness Education,Kinesiology and Exercise Sciences,141565,{},3
"The functions and dysfunctions of the sporting system will be examined from sociological perspectives. In addition, specific psychological constructs are presented in order to examine the relationship between environmental sources of influence and the individual's capacity for self-management in the sporting world.",300,KES,Psyc-Soc Aspects Of Sport,Kinesiology and Exercise Sciences,141565,{},3
"The spiritual experience of sport is central both to our basic motivation to take part in sports, and to achieving success. This course explores human aspects of the sport experience through the perspectives of sport psychology, philosophy, ethics, theology and religious studies.",302,KES,Sport &amp; Spirituality,Kinesiology and Exercise Sciences,141565,{},3
"This course provides an introduction to the principles and analysis of biomechanics, emphasizing the contribution of biomechanics to understanding human movement, and develops an understanding of mechanical and anatomical concepts related to human performance. Pre: PHYS  151, PHYS  151L.",307,KES,Biomechanics of Human Movement,Kinesiology and Exercise Sciences,141565,{},3
"This course will introduce the students to the fundamental principles of strength and conditioning while providing the skills necessary for proper selection, administration, and interpretation of athletic assessment across various modes of sport and activity, enabling the effective application of evidence-based training methodologies.",308,KES,Principles of Strength &amp; Cond.,Kinesiology and Exercise Sciences,141565,{},3
"Basic understanding of the principles of motor learning and performance in a variety of contexts including teaching, coaching, design of performer-friendly equipment and work environments, and everyday motor skill learning.",310,KES,Motor Learning,Kinesiology and Exercise Sciences,141565,{},3
"In this course, Students will have the opportunity to experience, evaluate and discuss a wide variety of tests and assessments from the field of sport and exercise science. Also, a basic understanding and appreciation of why and how of testing is a critical factor in health, physical education and athletics will be provided.",311,KES,Tests &amp; Meas. in Sports &amp; Exer,Kinesiology and Exercise Sciences,141565,{},3
"This course prepares students for personal trainer certification by developing knowledge and skills in major areas of exercise science like physiology, nutrition, assessment, program design, and exercise techniques, with an emphasis on safely instructing clients of diverse ages and fitness levels through consultations, evaluations, coaching and monitoring. Students will gain real-world preparation to provide attentive, safe, and goal-oriented services to clients while becoming eligible for leading personal trainer certifications. Pre: KES  212 and KES  308",312,KES,Personal Trainer Cert. Prep.,Kinesiology and Exercise Sciences,141565,{},3
"For students interested in the prevention and treatment of victims of legal and illegal use, misuses, and abuse of drugs and related substances. Examines the problems and consequences of people who have to deal with this dilemma.",320,KES,Drug Awareness,Kinesiology and Exercise Sciences,141565,{},3
"This course explores the intersection of sports and society. This course will examine a broad range of topics including the intersections of sports and culture, intersections of race, ethnicity, gender and class, ethics and the use of performance-enhancing drugs, economics, sports media, politics, and social justice.",321,KES,Sociology of Sports,Kinesiology and Exercise Sciences,141565,{},3
"Applying the principles of motor learning in different contexts such as teaching, coaching, design of performer-friendly equipment and work environments, rehabilitation, and everyday motor skill learning. Developing of motor learning programs.  Pre: KES  310.",330,KES,Applied Motor Learning,Kinesiology and Exercise Sciences,141565,{},3
"The endocrine system is the tissue and glands that secrete chemical messengers called hormones into the circulation to target specific receptors. This course will explore how the body depends upon this complex system to grow and maintain itself, and to respond to outside and inside perturbations, and fight diseases. Exercise and the endocrine system will be a prevalent topic in this course. Pre: KES  260 and KES  261 or BIOL  243 and BIOL  244.",333,KES,Endocrinology: Our Hormones,Kinesiology and Exercise Sciences,141565,{},3
"Introduction to allied health professions (e.g. Athletic Training, Physical Therapy, etc) that specialize in the care and prevention of musculoskeletal injuries in an active population. Course focuses on the recognition, orthopedic evaluation, treatment, management, and rehabilitation of various musculoskeletal injuries. (Previously Offered as KES  234 and KES  334) Pre: BIOL  243-243L and BIOL  244-244L",335,KES,Care &amp; Prevention Athletic Inj,Kinesiology and Exercise Sciences,141565,{},3
"This survey course examines the role of fitness/athletics and health-related activities in Hawaiian lifestyles, prior to foreign arrivals through to the late 20th century. The course also examines the consequences of political, economic, and cultural change on Native Hawaiian health-related activities and practices. (Same as HIST  339)",339,KES,Athletics &amp; Health in Hawaiʻi,Kinesiology and Exercise Sciences,141565,{},3
"This course presents a basic understanding of the multiple factors involved with body weight control and health.  This course centers on the important scientific factors of body weight control, including energy balance, basal metabolism, hunger versus appetite, nutritional function and needs, nature versus nurture of obesity, treatment of obesity, physical activity and it's importance in weight control and maintenance.  Eating disorders and medical interventions such as gastric bypass surgery will be presented.",340,KES,Science: Diet &amp; Weight Cntrl,Kinesiology and Exercise Sciences,141565,{},3
"Basic understanding of human anatomy from the perspective of movement, with emphasis on the skeletal and muscular systems. Pre: BIOL  243 and BIOL  243L",343,KES,Musculoskeletal Anatomy,Kinesiology and Exercise Sciences,141565,{},3
"Basic understanding of human musculoskeletal physiology from the perspective of internal function, with emphasis on aerobic and anaerobic metabolism during muscular function. Pre: KES  343",344,KES,Musculoskeletal Physiology,Kinesiology and Exercise Sciences,141565,{},3
Basic understanding of human physiology and its response to exercise and adaptations to various types of training. Physiological systems are reviewed as they respond to acute bouts of exercise and long-term exposure to exercise. Pre: BIOL  243 &amp; BIOL  244.,348,KES,Exercise Physiology,Kinesiology and Exercise Sciences,141565,{},3
"Student develop skills to effectively plan, design, implement, and evaluate health promotion programs in community/public health settings. Pre: KES  202",350,KES,Health Promotion Prog Planning,Kinesiology and Exercise Sciences,141565,{},3
This course introduces students to epidemiology priciples and methods. Topics covered include: measures of morbidity and mortality; vital statistics; incidence and prevalence measurements; adjustment of rates; measurements of risk; biological variability; screening; measurements of error; sampling; statistical significance; surveillance; study design; association and causation; and outbreak investigation.,351,KES,Epidemiology,Kinesiology and Exercise Sciences,141565,{},3
"A philosophical treatment of the role of sports in society and a meaningful life. Topics include the phenomenology of sport, the ethics of doping and artificial enhancement, leadership ethics, sports in the context of Hawaiʻi, and sport fandom. Pre: Previous work in philosophy or two courses in Kinesiology or instructor's consent. (Same as PHIL  355).",355,KES,Philosophy of Sport,Kinesiology and Exercise Sciences,141565,{},3
A history of sport from the ancient world to the present. Special attention to the history of sport in Europe and the Americas (Same as HIST  361),361,KES,History of Sport,Kinesiology and Exercise Sciences,141565,{},3
"This course will introduce the student to the importance of nutrition in the field of exercise sciences.  The purpose of this course is to bridge between nutritional concepts and exercise concepts, and the practical applications. Pre:  KES  207.",368,KES,Sports and Exercise Nutrition,Kinesiology and Exercise Sciences,141565,{},3
"Survey of methods and findings in the application of psychological principles in sport.  Topics include arousal and anxiety, cognitive processes, team performance, coaching behavior and techniques to maximize sports performance. (Same as PSY  370)",370,KES,Sport Psychology,Kinesiology and Exercise Sciences,141565,{},3
"This course examines contemporary issues affecting the status of indigenous health and wellness. Emphasis is placed on indigenous perspectives of health and wellness and indigenous ways of knowing in Hawaiʻi, Oceania and Turtle Island. (Attributes: GCC, HPP)",371,KES,Indigenous Health &amp; Wellness,Kinesiology and Exercise Sciences,141565,{},3
"This course offers students an opportunity to explore indigenous perspectives on movement, exercise and sport and it's relation to health with emphasis on Hawaiʻi, Oceania, and Turtle Island. This course considers the impacts of colonization, globalization and commodification of exercise and movement on indigenous health and well-being. (Attributes: HPP)",375,KES,Indigenous Kinesiology,Kinesiology and Exercise Sciences,141565,{},3
"Based on the principles of sport and exercise psychology. Focus on methods and programs applying sport psychology in the field of health and physical education to enhance performance, adhere people to physical exercise programs and support the overall well-being.  Pre: KES/PSY  370.",380,KES,Applied Sport Psychology,Kinesiology and Exercise Sciences,141565,{},3
"This course will study selected topics and research in Kinesiology and Exercise Science professions. The purpose of this class is to provide an on-going forum for presentation and discussion of emerging issues within various professions (e.g. health promotion, sport psychology, strength and conditioning, and allied health professions). Students will inventory their core values, interests, skills, and strengths and utilize them towards the application process. Students will learn about resume/curriculum vitae preparation, cover letter construction, interview preparation, the importance of social media presence (e.g. LinkedIN, facebook), and negotiation when applying for jobs/graduate school. Pre: Junior or Senior Standing",401,KES,Sem in KES: Profess.Develop,Kinesiology and Exercise Sciences,141565,{},2
"Study of the physiological mechanisms and the effects of aging on the human systems including the cardiopulmonary, musculoskeletal, neurological, sensory, metabolic, and endocrinological. This course will present the topic of physiology of exercise and aging.",440,KES,Physiology of Aging,Kinesiology and Exercise Sciences,141565,{},3
"Understanding the basics of various disabilities, how to assess the physical and motor skills of the disabled and how to develop individual activity programs for children and youth with disabilities.",443,KES,Adapted Physical Education,Kinesiology and Exercise Sciences,141565,{},3
"A planned, supervised, and evaluated practice experience. The goal of the practicum is to provide an opportunity for students to synthesize, integrate, and apply practical skills, knowledge, and knowledge, and training learned through courses. Students will gain professional experience in a professional health work environment, and work on health practice projects that are of particular interest to them. Pre: KES  202 and instructor consent. (Attributes: GCC)",450,KES,Health Promotion Practicum,Kinesiology and Exercise Sciences,141565,{},3
"The Purpose of this course is to introduce students who are interested in pursuing post-graduate degrees and professional careers in teh fields of physical therapy and occupational therapy to these professions. This course is divided into three separate sections: The Profession; The Practitioner; and The Practice. Pre: KES  260 and KES  261, or BIOL  243 and BIOL  244.",470,KES,Physical-Occupational Therapy,Kinesiology and Exercise Sciences,141565,{},3
"This course provides an opportunity for the study and application of the components of sports medicine, including, but not limited to: sports medicine ralated careers, organization, evaluation, and immediate care of athletic injuries, recognition, evaluation, and immediate care of athletic injuries, rehabilitation and management skills, emergency procedures, human anatomy and physiology, therapeutic modalities, and therapeutic exercise. Pre: KES  260 and KES  261, or BIOL  243 and BIOL  244.",480,KES,Sports Medicine,Kinesiology and Exercise Sciences,141565,{},3
"Development of analytical skills to improve existing listening, speaking, reading and writing skills at the first level.  Taught partially in Hawaiian from a Kumu Honua Mauli Ola philosophical base.  This course is designed primarily for students with previous high school/beginning college level Hawaiian. (Attributes: DH, GH, GL, HPP)",103,KHAW,First Lvl Trans Hawn Immersion,Keʻelikōlani Hawaiian Language,141565,{},4
"Strengthens and increases analytical skills as well as listening, speaking, reading and writing skills from KHAW  103 or HAW  102 or 105.  Taught primarily in Hawaiian from a Kumu Honua Mauli Ola philosophical base. Pre:  KHAW  103, or HAW  102 or 105 or placement exam. (Attributes: DH, GH, GL, HPP)",104,KHAW,First Lvl Partial Hawn Immers,Keʻelikōlani Hawaiian Language,141565,{},4
"Contents of KHAW  103-104 covered in one semester. Development and strengthening of analytical skills to improve existing listening, speaking, reading and writing skills at the first level.  Taught partially in Hawaiian from a Kumu Honua Mauli Ola philosophical base.  This course is designed primarily for student with previous high school/ beginning college level Hawaiian.  Meets two hours daily, Monday through Friday. (Attributes: DH, GH, GL, HPP)",108,KHAW,Accel First Lvl Hawn Immersion,Keʻelikōlani Hawaiian Language,141565,{},8
"Focus on strengthening skills in language analysis, vocabulary development, and writing at a university level Hawaiian.  This course is designed primarily for students educated through the medium of Hawaiian, first language speakers of Hawaiians and native speakers.  Pre: Placement exam. (Attributes: DH, GH, GL, HPP)",133,KHAW,First Lvl Hawn for Speakers,Keʻelikōlani Hawaiian Language,141565,{},4
"Fluency needed as a supporter of Hawaiian Revitalization. Stages/Subletters parallel units of structure and vocabulary topics in KHAW  103 &amp; KHAW  104 as follows: (A) Nā Pepeke Kumu; (E) Heluna, ʻAwe, Wā; (I) Nonoʻa, ʻOhana; (O) Kuanaʻike, Hoʻohālikelike; (U) Waeʻanona; (H) Alohuli (K) Pākuʻi Pepeke (M) Kālele, Kino ʻOkoʻa. May be repeated if subletters are different. Pre: Permission of the Department Chair.",190,KHAW,Fluency Community Support,Keʻelikōlani Hawaiian Language,141565,{},1
"Second year skills in Hawaiian developed from KHAW  104 base or higher.  Focus on accurate personal communicative use and connections to oral Hawaiian of earlier generations.  Pre: C or better in KHAW  104, 108 or 133 or HAW  202 or 205 or placement exam or equivalent approved by dept chair. (Attributes: DH, GL, HPP)",203,KHAW,Second Lvl Univ Hawn Immers I,Keʻelikōlani Hawaiian Language,141565,{},4
"Continuation and expansion of KHAW  203.  Pre:  C or better in KHAW  203 or equivalent as approved by Dept chair. (Attributes: DH, GL, HPP)",204,KHAW,Second Lvl Univ Hawn Immers II,Keʻelikōlani Hawaiian Language,141565,{},4
"Contents of KHAW  203 and 204 covered in one semester. Second year skills in Hawaiian developed from KHAW  104 base or higher.  Focus on accurate personal communicative use and connections to oral Hawaiian of earlier generations. Meets 2 hours daily, Monday through Friday.  Pre:  C or higher in KHAW  104 or KHAW  108 or KHAW  133 or equivalent. (Attributes: DH, HPP)",208,KHAW,Accel Sec Lvl Univ Hawn Immers,Keʻelikōlani Hawaiian Language,141565,{},8
"Continuation of HAW  133.  Pre:  B or better in HAW  133 or equivalent as approved by dept chair. (Attributes: DH, GL, HPP)",233,KHAW,Second Level Hawn for Speakers,Keʻelikōlani Hawaiian Language,141565,{},4
"Develops fluency as ʻohana and community supporters of Hawaiian Revitalization to support one’s children, grandchildren, and neighbors in Hawaiian medium/immersion schools. Stages/subletters parallel units of structure and vocabulary topics in KHAW  203 &amp; KHAW  204 as follows: (A) NKE I 1-7; (E) NKE I 8-15; (I) NKE II 15-21; (O) NKE II 22-27; (U)NKE III 1-2; (H) NKE III 3-4; (K) NKE III 5-6; (M) NKE III 7-8. May be repeated if subletters are different. Pre: Permission of the Department Chair.",290,KHAW,Fluency ʻOhana Support,Keʻelikōlani Hawaiian Language,141565,{},1
Continuation of KHAW  204 and KHAW  208 and KHAW  233.  Focus on analysis as the key to strong community use as a modeled in 19th and 20th century native speaker produced writings and tapes.  Pre: C or better in KHAW  204 or KHAW  208 or KHAW  233 or equivalent as approved by dept chair.,303,KHAW,Third Level Hawaiian I,Keʻelikōlani Hawaiian Language,141565,{},4
Continuation of KHAW  303.  Leadership development of informal use of Hawaiian among students from HAW  104-303. Pre:  C or better in KHAW  303 or equivalent as approved by department chair.,304,KHAW,Third Level Hawaiian II,Keʻelikōlani Hawaiian Language,141565,{},4
Practice skills developed in KHAW  304.  Pre:  Previous or simultaneous enrollment in KHAW  304.,333,KHAW,Applied Skills,Keʻelikōlani Hawaiian Language,141565,{},3
"Enhances Hawaiian language skills by analyzing various aspects of the Hawaiian language such as context, registers, domains, grammar, and pronunciation &amp; intonation. ʻO ke kahua ma mua, ma hope ke kūkulu. “Set the foundation first, then build.” Simple grammatical forms will be reviewed to set the foundation so that more advanced forms can be added to that foundation. Language forms commonly found and used in instruction also examined. Pre: Instructor's Consent",390,KHAW,Hoʻoikaika Mākau ʻŌlelo Hawaiʻi,Keʻelikōlani Hawaiian Language,141565,{},1
"Continuation of KHAW  304.  Advanced structures, expressions and patterns.   Conducted in Hawaiian. Pre:  C or better in KHAW  304 or permission of the instructor.",403,KHAW,Fourth Level Hawaiian I,Keʻelikōlani Hawaiian Language,141565,{},4
"Continuation of KHAW  403.  Advanced structures, expressions and patterns.   Conducted in Hawaiian. Language laboratory required.  Pre:  C or better in KHAW  403 or permission of the instructor.",404,KHAW,Fourth Level Hawaiian II,Keʻelikōlani Hawaiian Language,141565,{},4
"Sound system of the Hawaiian language. Stylistic and regional variation. Interaction of the Hawaiian sound system with the sound system of other languages, especially that of English.  Conducted in Hawaiian. Pre: KHAW  204 or KHAW  233 or higher or instructor's consent. Recommended: LING  102, LING  311. (Attributes: GCC, HPP)",453,KHAW,Hawaiian Phonetics &amp; Phonology,Keʻelikōlani Hawaiian Language,141565,{},3
Grammatical system of the Hawaiian language.  Conducted in Hawaiian. Pre: KHAW  204 or KHAW  233 or higher or instructor's consent. Recommended: LING  102,454,KHAW,Hawaiian Morphology &amp; Syntax,Keʻelikōlani Hawaiian Language,141565,{},3
A review and strengthening of Hawaiian language fluency skills with focus on the applicability to Hawaiian medium education.  Must be taken CR/NC.   Conducted in Hawaiian. Pre: KHAW  303 or simultaneous enrollment.,490,KHAW,Base-level Fluency Hawn Med Ed,Keʻelikōlani Hawaiian Language,141565,{},1
"Further development of Hawaiian language ability from the B.A. level to a level appropriate for graduate work. B.A. base reviewed with correction of any problem areas. Introduction of additional patterns, vocabulary, and styles in both oral and written form. Use of resources from late monarchy and early territorial periods. Pre:  Approved MA Candidate of the Indigenous Language and Culture Education Program or approval from the Graduate Program Chair. (Previously offered as HAW  603)",603,KHAW,Grad Level Hawn Lang,Keʻelikōlani Hawaiian Language,141565,{},3
