course_desc,course_number,course_prefix,course_title,dept_name,inst_ipeds,metadata,num_units
"Thirteenth course in Therapeutic Problem Solving series focusing on pharmacotherapy related to different disease states, applying pathophysiology, pharmacology, and medicinal chemistry concepts. This holistic approach fosters the development of a comprehensive clinical understanding to prevent and manage associated disease states. Pre: Enrolled in the Daniel K Inouye College of Pharmacy",567,PHAR,Therapeutic Prob Solving XIII,Pharmacy,141565,{},2
"Fourteenth course in Therapeutic Problem Solving series focusing on pharmacotherapy related to different disease states, applying pathophysiology, pharmacology, and medicinal chemistry concepts. This holistic approach fosters the development of a comprehensive clinical understanding to prevent and manage associated disease states. Pre: Enrolled in the Daniel K Inouye College of Pharmacy",568,PHAR,Therapeutic Prob Solving XIV,Pharmacy,141565,{},2
"Last course in Therapeutic Problem Solving series focusing on pharmacotherapy related to different disease states, applying pathophysiology, pharmacology, and medicinal chemistry concepts. This holistic approach fosters the development of a comprehensive clinical understanding to prevent and manage associated disease states. Pre: Enrolled in the Daniel K Inouye College of Pharmacy",569,PHAR,Therapeutic Prob Solving XV,Pharmacy,141565,{},2
"Major philosophers, methods, and issues in Western and non- Western philosophy.  Discussion of such problems as our knowledge of reality, the freedom of the will, the relations between the mind and body, morality, the meaning of life and the existence of God. (Attributes: FGC)",100,PHIL,Intro to Philosophy,Philosophy,141565,{},3
"Philosophical teachings of Hinduism, Buddhism, Jainism, Confucianism, Taoism, Neo-Confusianism, and Shintoism. (Attributes: DH, GAHP, HPP)",101,PHIL,Intro to Asian Philosophy,Philosophy,141565,{},3
"Informal logic: Study of practical reasoning, argument, and the use and misuse of language.  Emphasis on development of critical thinking skills. (Attributes: DH)",209,PHIL,Reasoning,Philosophy,141565,{},3
"Philosophy of the Pre-Socratics, Plato, Aristotle and Roman thinkers. (Attributes: DL)",211,PHIL,History of Ancient Philosophy,Philosophy,141565,{},3
From the Renaissance to the 19th century. Recommended:  PHIL  211. (Attributes: DH),213,PHIL,History of Modern Philosophy,Philosophy,141565,{},3
"Contemporary ethical issues, such as abortion, euthanasia, the death penalty, sexual equality, sexual integrity, discrimination and reverse discrimination, violence, pornography, ethnic injustice, and environmental and population control. (Attributes: DH)",220,PHIL,Social Ethics,Philosophy,141565,{},3
"The sources and limits of human knowledge.  Classical and contemporary epistemological theories, and their application to the everyday search for knowledge. (Attributes: DH)",230,PHIL,"Belief, Knowledge &amp; Truth",Philosophy,141565,{},3
"Survey of classical and contemporary perspectives of the philosophy of love, marriage, relationships, sex, sexual identity, representations of sex and sexuality. (Previously offered: PHIL  180; Same as WS  270). (Attributes: DH, GCC)",270,PHIL,Love and Sex,Philosophy,141565,{},3
"The historic Indian schools of thought, Brahmanism, Jain, Carvaka, Buddhist, Samkyha, Yoga, Nayaya, Vaisheskika, Mimamsa, and Vedanta.  The main philosophers and thinkers of India including Gandhi, Radhakrishnan, and Tagore. Recommended:  previous work in philosophy or religious studies. (Attributes: DH, GAHP, HPP)",300,PHIL,History of Indian Philosophy,Philosophy,141565,{},3
"History of the Confucian, Taoist, and Buddhist philosophies and their interaction in China.  The pivotal thinkers including Mao.  Recommended:  previous work in philosophy or religious studies. (Attributes: DH, GAHP, HPP)",301,PHIL,Hist Of Chinese Philosophy,Philosophy,141565,{},3
"History of Buddhist philosophy and its cultural influence and intellectual development in Asia and Hawaiʻi. Recommended:  previous work in philosophy or religious studies. (Attributes: DH, GAHP, HPP)",302,PHIL,Hist Of Buddhist Philosophy,Philosophy,141565,{},3
"Philosophical examination of the meaning of cultural diversity and pluralism for questions concerning community and knowledge from a variety of American and non-western cultures as well as their interactions with categories of identity, based upon nation, race, class, gender and sexuality.  Addresses the interactions of the social experience of individuals based upon categories of identity and the emergence of forms of community and knowledge.  A global or transnational section will be one component of the course. (Same as WS  304). (Attributes: ALEX, DH, FGB, GCC)",304,PHIL,"Race, Ethics &amp; Cultural Diversity",Philosophy,141565,{},3
"The sources and limits of human knowledge. Classical and contemporary epistemological theories, and their application to the everyday search for knowledge. The course will cover various themes of social epistemology including feminist, indigenous, and alternative epistemologies.(Same as WS  307)",307,PHIL,Social Epistemology,Philosophy,141565,{},3
"Puzzling problems in Western thought, such as the nature of personal identity, the freedom of the will, time, and the relation between mind and body.  Pre: previous work in philosophy. (Attributes: DH)",310,PHIL,Metaphysics,Philosophy,141565,{},3
"The history of 19th century philosophy, with an emphasis on the philosophers of continental Europe, including Hegel, Schopenhauer, Kierkegaard, and Nietzsche. (Attributes: DH)",313,PHIL,19th Century Philosophy,Philosophy,141565,{},3
Classical and contemporary theories of right and good.  Pre: previous work in philosophy. (Attributes: DH),315,PHIL,Ethical Theory,Philosophy,141565,{},3
"Good and right applied to economic, political, and religious establishments; obligation, freedom of dissent, capital punishment, violence, rights, revolution, and war.  Pre: previous work in philosophy.  Recommended:  PHIL  220. (Attributes: DH)",320,PHIL,Social &amp; Political Phil,Philosophy,141565,{},3
"Professional conduct is being questioned as never before—lawyers, physicians, engineers, accountants, etc., are criticized for disregarding the rights of clients and the public interest.  The course addresses the ethical problems of “the professions” in general and will focus on professions in business, law, and health care.  Pre: previous course work in philosophy. (Attributes: DH)",323,PHIL,Professional Ethics,Philosophy,141565,{},3
"Problems and controversies in the nature of law and its bearing on human conduct.  Topics: legal and moral obligation, obedience and respect, enforcement of morality, punishment and responsibility, justification of practices such as plea bargaining, bail, prosecutorial discretion, etc.  Pre: previous work in philosophy. (Attributes: DH)",325,PHIL,Philosophy Of Law,Philosophy,141565,{},3
"An examination of controversial topics related to life and health, such as euthanasia, treatment of animals, genetic engineering, individual autonomy, and the health care system. Pre: Previous course work in philosophy. (Attributes: DH)",327,PHIL,Bioethics,Philosophy,141565,{},3
"Exploration of the visual, the sensory, and the embodied across legal, social, political, and cultural frameworks involving materialism, mobility-ies, place/placelessness, and public memory (same as POLS  328). (Attributes: DS)",328,PHIL,Visual Politics,Philosophy,141565,{},3
"Central ethical questions concerning the natural world, including environmental justice, responding to climate change and environmental devastation, and the relationship between human beings and the environment. (Attributes: DH)",329,PHIL,Environmental Ethics,Philosophy,141565,{},3
"The aesthetic object, form in art, representation, meaning in art, and claims of knowledge in art.  Pre: previous work in philosophy and in art or music. (Attributes: DH)",330,PHIL,Philosophy of Art,Philosophy,141565,{},3
"Philosophical problems in religious beliefs and religious knowledge.  The existence of God, immorality, the problem of evil.  Pre: previous work in philosophy or religious studies. (Attributes: DH)",340,PHIL,Philosophy Of Religion,Philosophy,141565,{},3
"A study of the mutual influences of Western and Eastern philosophical traditions and the potential each has to respond to the programs of the other. Pre: previous work in philosophy or instructor's consent. (Attributes: DH, HPP)",343,PHIL,Comparative Philosophy,Philosophy,141565,{},3
"Techniques of symbolic logic, including propositional logic, predicate logic and the logic of relations. (Attributes: GQ)",345,PHIL,Symbolic Logic,Philosophy,141565,{},3
Introduction to Indigenous Hawaiian philosophy and how to engage with Aloha ‘Āina relying upon a methodology and pedagogy consistent with the philosophy being discussed. Pre: previous work in philosophy. (Attributes: HPP),350,PHIL,Hawaiian Phil: Aloha ʻĀina,Philosophy,141565,{},3
"A philosophical treatment of the role of sports in society and a meaningful life. Topics include the phenomenology of sport, the ethics of doping and artificial enhancement, leadership ethics, sports in the context of Hawaiʻi, and sport fandom. Pre: Previous work in philosophy or two courses in Kinesiology or instructor approval. (Same as KES  355). (Attributes: DH)",355,PHIL,Philosophy of Sport,Philosophy,141565,{},3
The themes which recur in the works of existential philosophers from the 19th century to the present. Pre: junior standing or instructor's consent. (Attributes: DH),360,PHIL,Existentialism,Philosophy,141565,{},3
"Exploration of the feminist contributions to traditional philosophical questions in metaphysics, epistemology, and ethics as swell as examining the philosophical implications of the intersections of race, class, gender and sexuality. (Same as WS  375) (Attributes: ALEX, DH, GCC)",375,PHIL,Feminist Philosophy,Philosophy,141565,{},3
"Topics in the philosophy of Ludwig Wittgenstein, such as: meaning, understanding, pain, private language, “family resemblance,” language-games, knowledge and certainty, other minds, forms of life and the purpose of philosophy.  Pre: previous work in philosophy. (Attributes: DH)",381,PHIL,Philosophy Of Wittgenstein,Philosophy,141565,{},3
"History and philosophy of Marxism from the early Marx through recent times, including such topics as:  dialectical materialism, alienation, exploitation, surplus value, class struggle, revolution, socialism, communism, and the Marxian critique of capitalism, imperialism, fascism, terrorism, and capitalist cultural hegemony.  Pre:  Previous work in philosophy or instructor's consent.",385,PHIL,Philosophy of Marxism,Philosophy,141565,{},3
"Natural science as a knowledge-seeking activity.  Major episodes in the history of the physical and biological sciences; philosophical understanding of scientific observation, theory, and revolutionary change.  Pre: previous work in philosophy or consent of instructor. (Attributes: DH)",390,PHIL,History &amp; Phil of Science,Philosophy,141565,{},3
"Philosophical examination of the implications of modern biology for how we understand ourselves and our relations to the natural world.  Evolutionary, genetic, developmental, and ecological topics will be discussed.  Pre: previous work in philosophy and biology, or consent of instructor.  (Same as BIOL  392)",392,PHIL,Biology &amp; Philosophy,Philosophy,141565,{},3
"Philosophical study of how human diversity interacts with social norms.  Topics include health and illness, disability, gender, and sexual orientation.  Perspectives from biology and the social sciences are included in a study of how beliefs about normality vary between cultures, change through time, and affect human relations.  Pre: Previous work in philosophy or instructor's consent.  (Same as WS  393). (Attributes: DH)",393,PHIL,"Normality, Abnormality &amp; Soc",Philosophy,141565,{},3
"Examination of the philosophical theories of nature from classical  to contemporary texts, and their interaction with questions of metaphysics, identity, the environment, and human freedom.",412,PHIL,Philosophy of Nature,Philosophy,141565,{},3
"Impact of science and technology on various philosophical issues. Through a variety of readings that exemplify the field's content, students will examine the social, political, aesthetic, ethical, economic, and environmental constructs that shape modern institutions in science and technology. (Same as WS  416)",416,PHIL,"Science, Technology &amp; Human Values",Philosophy,141565,{},3
"Chief philosophical teachings of Zen, its methods and cultural influences.  Comparative study of Zen and Western thought.  Pre: previous work in philosophy or religious studies, or consent of instructor.  Recommended:  PHIL  302. (Same as JPST  430) (Attributes: DH, GAHP, HPP)",430,PHIL,Philosophy of Zen,Philosophy,141565,{},3
"Philosophical ideas of Lao Tzu, Zhuangzi, and the Neo- Daoists, and their influences upon the lives of the Chinese and Japanese peoples. Comparative study of Daoist and Western philosophy. Pre: previous work in philosophy or religious studies, or instructor's consent. Recommended: PHIL  301 (Attributes: DH, GAHP, HPP)",435,PHIL,Daoism,Philosophy,141565,{},3
"Important tenets and major schools of Mahayana Buddhist philosophy in India, China, Japan, Tibet, and Hawaiʻi. Comparative study of Mahayana and Western philosophy.  Pre: previous work in philosophy, religious studies, or instructor's consent.  Recommended:  PHIL  302. (Same as JPST  450) (Attributes: DH, GAHP, HPP)",450,PHIL,Mahayana Buddhist Phil,Philosophy,141565,{},3
"Philosophy of Friedrich Nietzsche. Topics include the death of God, the problem of morality, perspectivism, the overhuman, the will to power, the eternal recurrence, and the relationship between philosophy and art. Pre: PHIL  213 or PHIL  313 or PHIL  360 or consent of instructor.",480,PHIL,Nietzsche,Philosophy,141565,{},3
"A study of a range of environmental ethical theories, conservation ethics and environmental justice paradigms. An examination of the historical, political, and social context in conservation management: the problem of wilderness, biocultural frameworks, and the ethics of invasive species. This course is dual listed with CBES  684. (Attributes: DH, GCC)",484,PHIL,ConservEthics &amp; EnvironJustice,Philosophy,141565,{},3
For serious students of philosophy.  The topics vary and the course may thus be repeated for credit.,496,PHIL,Seminar in Philosophy,Philosophy,141565,{},3
This course is the fifth course in a sequential series. Content encompasses exposure to institutional hospital pharmacy. Pre: Acceptance in the UH Hilo CoP (Attributes: GCC),505,PHPP,Intr Pharm Prac Experiential V,Pharmacy Practice,141565,{},1
"This course introduces the pharmacy students to statistical concepts and research methods important to the practice of pharmacy and medicine. Students will learn the various research designs and methods, evaluate their strengths their weaknesses, and when each is appropriate and inappropriate to use. Statistical concepts include descriptive and inferential statistics, measurement, sampling, probability, normal distribution, sampling distributions, parameter estimation including point and confidence interval estimation, hypothesis testing, sample size, statistical power, common inferential statistical tests including parametric and nonparametric tests being used in research. Students will be developed familiarity with reading excerpts from articles published in the medical literature and will be well versed in the interpretation of statistical principles and methods being used as well as results of analyses. The goal of this course is to give the student an appreciation for the role of statistics in health care (medical) research.",508,PHPP,Intro to Biostatistics,Pharmacy Practice,141565,{},2
"This course serves as an introduction to patient-focused pharmacy practice through the topic of self-care, including identification and use of appropriate drug information resources and in-depth study of nonprescription medications for a variety of self-treatable conditions. This course also demonstrates the importance of professionalism in the communicative consultation process. In addition, this course introduces the Top 100 prescription medications. Content from this course will continue into the Self-Care II course.",510,PHPP,Pharmacy Self Care I,Pharmacy Practice,141565,{},2
"This course continues the in-depth examination of self-care and over-the-counter (OTC) medications, and development of Top 200 prescription drug knowledge, begun in PHPP  510. Additionally, this course provides a foundation for organizing patient-specific information necessary in the management of medical conditions, as well as identifying and interpreting laboratory test values commonly used in the management of medical conditions, in preparation for the Integrated Therapeutics course series. Pre: Admissions to the PharmD program.",511,PHPP,Pharmacy Self Care II,Pharmacy Practice,141565,{},2
"This course will allow students to apply their knowledge of clinical research study designs, epidemiology, evidence- based medicine, and biostatistical principles to interpret and evaluate the findings published in the medical literature, and translate evidence to support patient-care decisions. Students are expected to read, interpret, evaluate, and synthesize information published in medical literature. Objective and rational conclusions are drawn from the analysis of information and applied to patient care. Examinations and literature evaluation project assignment are based on materials from didactic lectures and published articles. Evaluation of medical literature is a cornerstone of clinical pharmacy practice and is an important component of integrated therapeutics courses and experiential rotations. Pre: PHPP  508.",514,PHPP,Evidence-Based Medicine,Pharmacy Practice,141565,{},3
"This is the first in a sequence of four courses. Pathophysiology, medicinal chemistry, pharmacology and therapeutics will be integrated into the teaching of pharmacotherapy based on organ systems and disease states. Students will learn to apply knowledge of the basic sciences to drug treatment of specific disorders. Topics covered in this course include autonomic, renal and cardiovascular systems.",515,PHPP,Integrated Therapeutics I,Pharmacy Practice,141565,{},7
"This is the third course in the four-part integrated therapeutics series. An integrated approach to the following topics will be covered: disease states associated with the genitourinary, gastrointestinal, reproductive, and hematologic systems, pain management, and oncology. Pre: PHPP  516",517,PHPP,Integrated Therapeutics III,Pharmacy Practice,141565,{},7
"This is the fourth and final course in the integrated therapeutics series. An integrated-discipline approach to the following topics will be covered: the central nervous system, pediatrics and geriatrics, neurological disorders, anesthetics, and critical care medicine. Pre: PHPP  517",518,PHPP,Integrated Therapeutics IV,Pharmacy Practice,141565,{},7
"This course is designed to give students a history and overview of the American health care system. Roles of the major drivers in health care including government, employer groups, HMO's, hospitals, providers, and payors will be examined. Market components of prescription drug utilization will be discussed in detail. Additionally, the European health care model will be compared to the American system.",519,PHPP,Health Care Systems,Pharmacy Practice,141565,{},2
"This course provides the student with a working knowledge of the legal and ethical responsibilities of pharmacists. Content includes: Federal and State Statutes; the legislative and regulatory process that produce statutes, rules and regulations; and discussion of the nature and influence of moral and ethical dimensions on decisions and actions taken in the delivery of patient-centered health care.",520,PHPP,Pharmacy Law and Ethics,Pharmacy Practice,141565,{},3
"This course will be the capstone course for the Pharmacy Practice curriculum before the Advanced Pharmacy Practice Experiential rotations and will emphasize critical thinking and evaluation for multi-disease state patient cases as well as patient education. This course will consist of workshops and case presentations to incorporate previously taught material in order to prepare students for experiences across all patient-care settings, including acute care, ambulatory care, and community pharmacy. Students will work individually and in various sized groups to review patient cases and present in the structured SOAP format.",521,PHPP,Applied Pharmaceutical Care,Pharmacy Practice,141565,{},3
"The first part of the course, marketing of pharmacy services, programs or products, is intended to use the marketing skills learned, to effectively collaborate in groups to develop a two market plan for innovative pharmacy services, programs or products.  In developing these market plans, topics covered in lecture including consideration of economic, environmental, marketing and financial factors are stressed along with the use of appropriate outcome measures to determine success of the plans.  Group interaction and activities will further help build upon principles learned in the course and ultimately culminate in the completion of a formal business proposal which will be presented to an executive committee. The second part of this course deals with practice manage- ment and is designed to introduce concepts and encourage further development of essential managerial skills, specific areas of focus includes personnel management, dealing with conflict in the work place, and continuous quality improve- ment.  Communicating, understanding, and collaborating with fellow employees or colleagues are vital to any practice and are demonstrated through activities over the duration of the course.  This section also includes certain standard practice that is carried out as managerial responsibilities in the health care setting.  Pre:  Admission to PharmD.",522,PHPP,Pharm Practice Mgmt &amp; Mktng,Pharmacy Practice,141565,{},2
"This course provides students with an overview of what constitutes a healthy lifestyle and how it contributes to the prevention of chronic disease.  Pharmacists are key providers in helping to educate patients about wellness and disease prevention.  Disease State Management (DSM) is an organized, coordinated process to manage specific disease states over the entire course of the disease to improve clinical and economic outcomes for the patient.  Students will be exposed to important DSM models such as the Asheville Project in North Carolina and utilize this information in creating a disease management program.",523,PHPP,Wellness &amp; Disease Prevention,Pharmacy Practice,141565,{},2
"This course introduces pharmacy students to the basic concepts, terminology, and applications of pharmacoeconomics and its usefulness in making informed decisions in health care.",524,PHPP,Pharmacoeconomics,Pharmacy Practice,141565,{},2
"This course is designed as an overview of complementary medicine.  Students will be presented a balanced unbiased view of the theory and practice of some of the more popular complementary therapies such as acupuncture, traditional Chinese medicine, homeopathy, herbal medicine, and other dietary supplements. (Attributes: HPP)",525,PHPP,Complementary Medicine,Pharmacy Practice,141565,{},3
"This course will introduce the students to different types of drug literature and drug information resources; primary, secondary and tertiary resources; evidence-based medicine resources; adverse drug reactions and medication error reporting systems; formulary management; investigational drugs; and tools to keep pharmacists knowledgeable of current advancements. In addition, student pharmacists will gain skills to evaluate drug information resources, systematically approach drug information requests, communicate health information and create a drug monograph.",527,PHPP,Drug Information,Pharmacy Practice,141565,{},2
"This course serves as an introduction to pharmacy practice. The multi-cultural State of Hawaiʻi will serve as a practical laboratory for students to begin practicing the skills necessary to provide and communicate pharmaceutical care. This course is designed to introduce student pharmacists to the skills needed to communicate effectively with patients and the interprofessional skills needed to communicate with other healthcare providers and professionals. The course is also designed to enhance student confidence in public speaking. The culture component of the course is designed to introduce student pharmacists to the skills needed to communicate effectively with patients and other healthcare providers, and understanding the impact of cultural diversity. In-class exercises will facilitate cultural self-awareness, disparities in healthcare, exploration of cultural diversity, and methods to apply communication skills in practice.",528,PHPP,Pharmacy Comm &amp; Culture,Pharmacy Practice,141565,{},3
"This course is designed to give students an introduction to basic research methods, including measurement and designs as well as research ethics and writing skills for research. This course is required for pharmacy students in the Certificate Program in Health Science Research.",530,PHPP,Basic Research Methods,Pharmacy Practice,141565,{},1
"This course is designed to give students an introduction to survey, epidemiology, and qualitative research methods. This course is required for students enrolled in the Health Science Research certificate program.",531,PHPP,"Survey, Epidem, Qual Methods",Pharmacy Practice,141565,{},1
