course_prefix,course_number,course_title,course_desc,num_units,dept_name,inst_ipeds,metadata
FSHN,185,Food Science and Human Nutrition,"Integrates natural science concepts basic to the study of human nutrition. Emphasizes nutrient requirements of healthy individuals, nutrient categories and characteristics, physiological functions, and food sources. Includes review and adaptation of dietary practices to reflect current nutritional issues.",3,Food Science & Human Nutrition,141839,"Class Hours: 3 lecture; Prerequisites: ENG 22 with grade C or better, or placement at ENG 100, or consent"
FSHN,285,The Science of Human Nutrition,"Provides an overview of the principles of nutritional science. Includes descriptions and functions of nutrients, digestion and absorption, effects of deficiencies and toxicities, requirements throughout the life cycle, food sources, nutrient interactions, dietary assessment, cultural sensitivity, sports nutrition, eating disorders, global health issues, drug interactions, and nutrition as it pertains to dental health. Required for UHMC Dental Hygiene program.",3,Food Science & Human Nutrition,141839,"Class Hours: 3 lecture; Prerequisites: ENG 22 with grade C or better or placement at ENG 100, and MATH 75X with grade C or better or placement at least MATH 82, or consent"
GIS/ICS,150,Introduction to GIS/GPS,"Introduces applications of geographic information systems (GIS) with a special emphasis on using ArcView GIS. Includes database construction and techniques for spatial data manipulation, analysis, and display. Teaches use of global positioning system (GPS). Explores cross-disciplinary applications in the natural and social sciences.",4,Geographic Information Systems,141839,"Class Hours: 4 lecture; Prerequisites: ICS 101 or BUSN 150, either with grade C or better, or consent."
GIS,180,GIS in Ecosystem Management,Uses global positioning system (GPS) technologies and advanced geographic information system (GIS) principles for data collection and analysis. Applies GIS techniques to develop geodatabases and computer-generated map layers for specific sites. Evaluates resource management decisions for natural ecosystem conservation and habitat restoration projects.,4,Geographic Information Systems,141839,"Class Hours: 4 lecture; Prerequisites: GIS/ICS 150 with grade C or better, or consent."
GEO,101,The Natural Environment,"Surveys the natural environment: weather, climate, soil, vegetation, and landforms, with emphasis on Hawai‘i. Lab optional.",3,Geography,141839,Class Hours: 3 lecture
GEO,101L,The Natural Environment Laboratory,"Introduces the geographer’s tools: globes, atlases, maps, and aerial photographs. Uses laboratory investigation techniques to understand concepts of physical geography. Special emphasis on Hawai‘i and on human modification of the environment.",1,Geography,141839,"Prerequisites: GEO 101 (or concurrent), or consent."
GEO,102,World Regional Geography,"Surveys the world’s major cultural regions. Explores economic, environmental, social, and political conditions from a geographical perspective.",3,Geography,141839,"Class Hours: 3 lecture; Prerequisites: ENG 22 with grade C or better, or placement at ENG 100, or consent."
GG,101,Introduction to Geology,"Presents principles of physical geology including the composition and structure of the earth, its evolution over geologic time, and processes shaping the earth’s crust including continental drift, volcanism, earthquakes, and erosion.",3,Geology & Geophysics,141839,"Class Hours: 3 lecture; Prerequisites: ENG 22 with grade C or better or placement at ENG 100, and MATH 75X with grade C or better or placement at least MATH 82, or consent."
GG,101L,Introduction to Geology Lab,Laboratory to accompany GG101 or GG103.,1,Geology & Geophysics,141839,"Prerequisites: GG 101 or GG 103 (or concurrent); ENG 22 with grade C or better or placement at ENG 100, and at least MATH 75X with grade C or better or placement at least MATH 82, or consent."
GG,103,Geology of Hawaiian Islands,"Surveys Hawaiian geology and geologic processes. Includes origin of the Hawaiian Islands, volcanism, rocks and minerals, landforms, stream and coastal processes, landslides, earthquakes and tsunamis, groundwater, and geologic and environmental hazards.",3,Geology,141839,Class Hours: 3 lecture
HAW,100,Language in Hawai‘i: A Microcosm of Global Language Issues,"Introduces students to essential linguistic features of Hawaiian and language related issues enhancing communicative experience in Hawai‘i. Analyzes social, cultural, political, and linguistic cross-cultural interaction locally and globally.",3,Hawaiian,141839,Class Hours: 3 lecture
HAW,101,Elementary Hawaiian I,"Introduces speaking, reading, and writing elementary Hawaiian. Treats structural points inductively. Devotes four out of five hours to drill and practice. Daily lab work determined by individual need.",4,Hawaiian,141839,Class Hours: 3 lecture
HAW,102,Elementary Hawaiian II,"Continues HAW 101 instruction to write, speak, and read Hawaiian. Devotes four out of five hours to drill and practice. Daily lab work determined by individual need.",4,Hawaiian,141839,"Class Hours: 3 lecture; Prerequisites: HAW 101, or consent."
HAW,104,Hawai‘i: Language Through Hula,"Introduces conversational Hawaiian language through the medium of dance (hula) and song. Requires study, memorization, and close examination of Hawaiian vocabulary and simple sentence structure.",3,Hawaiian,141839,Class Hours: 3 lecture
HAW,201,Intermediate Hawaiian I,Continues HAW 102. Uses advanced Hawaiian grammatical structure with emphasis placed on speaking Hawaiian. Practices translation of materials from classical Hawaiian literature. Devotes two out of five hours to drill and practice. Daily lab work determined by individual need.,4,Hawaiian,141839,"Class Hours: 3 lecture; Prerequisites: HAW 102, or consent."
HAW,202,Intermediate Hawaiian II,Introduces further advanced Hawaiian grammatical structures with emphasis placed on speaking Hawaiian. Drills translating materials from classical Hawaiian literature. Devotes two of five hours to drill and practice. Daily lab work determined by individual needs.,4,Hawaiian,141839,"Class Hours: 3 lecture; Prerequisites: HAW 201, or consent."
HAW,221,Hawaiian Conversation,"Practices systematic control of spoken Hawaiian. Further develops vocabulary for accurate, mature expression.",3,Hawaiian,141839,"Class Hours: 3 lecture; Prerequisites: HAW 202, or consent."
HAW,261,Hawaiian Literature in Translation,"Surveys Hawaiian literature, including prose narration and poetry with reference to Polynesian and world themes and forms from pre-contact to discovery. Introduces a full range of Hawaiian stories, chants, poems, songs, and sayings which have been translated into English.",3,Hawaiian,141839,"Class Hours: 3 lecture; Prerequisites: ENG 100 with grade C or better, or consent."
HWST,211,Ethnobotany,"Identifies endemic, indigenous, and Polynesian introduced flora of Hawai‘i. Examines the many uses of Hawai‘i’s flora by the indigenous people. Reveals the relationship of gods/plants/man, and connects belief and practices with the intentional migration of specific plants. Meets Social Science requirement, not Natural Science requirement.",3,HWST,141839,Class Hours: 3 lecture
HWST,176,History and Development of Hawaiian Music,"Focuses on the history and development of traditional and acculturated vocal and instrumental Hawaiian music. Discusses Hawaiian dance genres related to the music. Examines Hawaiian music and dance as an organization of sound and movement and as a product of culture and people. Uses sound recordings, video presentations, and live performances of the various music genres discussed.",3,HWST,141839,"Class Hours: 3 lecture; Prerequisites: HAW 101 and HWST 107, both with a grade C or better, or consent."
MUS,176,History and Development of Hawaiian Music,"Focuses on the history and development of traditional and acculturated vocal and instrumental Hawaiian music. Discusses Hawaiian dance genres related to the music. Examines Hawaiian music and dance as an organization of sound and movement and as a product of culture and people. Uses sound recordings, video presentations, and live performances of the various music genres discussed.",3,MUS,141839,"Class Hours: 3 lecture; Prerequisites: HAW 101 and HWST 107, both with a grade C or better, or consent."
HWST,100B,Intro to Hawaiian Culture: Communication-Basic Language and Phrases,Develops correct pronunciation and usage of basic Hawaiian language and phrases.,1,HWST,141839,Class Hours: 1 lecture
HWST,100C,"Intro to Hawaiian Culture: Worldwide-Values, Folklore, and Cultural Practices",Provides an orientation to traditional and contemporary Hawaiian practices and values.,1,HWST,141839,Class Hours: 1 lecture
HWST,100D,"Intro to Hawaiian Culture: Landscape-Historical Events, Physical Features, and Unique Flora & Fauna of Maui and Hawai‘i","Explains important historical events of Maui and Hawai‘i and identifies their unique flora and fauna, physical features, and scenes.",1,HWST,141839,Class Hours: 1 lecture
HWST,107,Hawai‘i: Center of the Pacific,"Introduces the unique aspects of Hawai‘i and Hawaiian culture in relation to the larger Pacific, including geography, origins, language, religion, land, art, and history.",3,HWST,141839,"Class Hours: 3 lecture; Prerequisites: ENG 22 with grade C or better, or placement at ENG 100, or consent."
HWST,111,The Hawaiian ‘Ohana,Examines culture of Hawaiian people as expressed in home and family. Provides understanding of the family as the basis of larger Hawaiian society. Compares and contrasts both ancient and modern aspects of the Hawaiian family. Uses Hawaiian terminology.,3,HWST,141839,"Class Hours: 3 lecture; Prerequisites: HWST 107 with grade C or better, or consent."
HWST,132,Hula ʻOlapa (Foundational Hawaiian Dance),"Studies foundational hula and chant from pre-contact, post-contact, Monarchy era and contemporary Hawaiʻi. Students will be introduced to hula instruments, costuming and adornments, the kuahu hula and beginning choreography.",2,HWST,141839,"Class Hours: 1 lecture; Prerequisites: HAW104 with grade C or better, or instructor consent."
HWST,133,Hula ʻAuana (Contemporary Hawaiian Dance),"Studies contemporary Hawaiian dance from post-contact, Monarchy era and contemporary Hawaiʻi. Students will be introduced to hula instruments, costume and adornments appropriate to hula ʻauana and beginning choreography.",2,HWST,141839,"Class Hours: 1 lecture; Prerequisites: HAW 104 with grade C or better, or consent."
HWST,205,Hawaiian Music in Action A Mele ʻĪna E Mele Pili Kanaka I Other,"Teaches Hawaiian songs as a means of strengthening knowledge of language, poetry, and culture. Conducted primarily in Hawaiian. (May be repeated for credit if subletters are different.)",2,HWST,141839,"Class Hours: 1 lecture; Prerequisites: HAW 102, or consent."
HWST,207,Mālama Ahupuaʻa: Resource Management,"Examines the ahupuaʻa system: its mythologies, place names, history, poetry, and early documents of the Hawaiian nation as it was conceptualized by the ancient Hawaiians. Explores the relevance of the ahupuaʻa system in modern society.",3,HWST,141839,"Class Hours: 3 lecture; Prerequisites: HWST 107 with grade C or better, or consent."
HWST,211L,Hawaiian Ethnobotany Lab,Studies the interactions between the Hawaiian culture and plants/plant environments. Considers different levels and types of interactions and patterns of interactions between people and plants. Places emphasis on the importance of cultural upbringing. Includes field trips in lieu of lab. (Crosslisted as BOT 105L.),1,HWST,141839,"Prerequisites: HWST 211 or BOT 105, either with a C or better (or concurrent)."
HWST,213,Hawaiian Ethnozoology,"Surveys and identifies Hawaiian fishes, birds, and other creatures, and their place in Hawaiian culture. Explores traditional methods of capture, practical uses, and conservation techniques. Uses Hawaiian terminology.",3,HWST,141839,"Class Hours: 3 lecture; Prerequisites: HAW 101, or consent."
HWST,222,Ma‘awe: Hawaiian Fiber Arts,"Examines Hawaiian cultural fiber arts. Develops advanced fiber arts projects of Hawaiian cultural significance or ceremonial use. Practices proper protocols used in the procurement of materials needed to complete various fiber arts projects. Explores related protocol and methods for gathering, Native Hawaiian gathering rights, and the type of environments in which specific materials grow and can be gathered. (May be repeated for unlimited credit.)",3,HWST,141839,"Class Hours: 3 lecture; Prerequisites: HWST 211 or BOT 105, either with grade B or better, or consent."
HWST,231,Native Perspectives on Hawaiian Culture,"Explores Native Hawaiian culture from traditional times to present. Examines values, social relationships, religion, traditional practices and arts.",3,HWST,141839,"Class Hours: 3 lecture; Prerequisites: HWST 101, or HWST 100BCD, or HWST 107, any with grade C or better, or consent."
HWST,241,He Mooalii No Ihikapalaumaewa: Maui Genealogies,"Identifies and analyzes Maui chiefly genealogies, related histories, and wahi pana or significant places.",3,HWST,141839,"Class Hours: 3 lecture; Prerequisites: HWST 107 with grade C or better, or consent."
HWST,262,Pana Maui: Maui’s Sacred Hawaiian Places,"Examines the sacred Hawaiian places of Maui, including accounts of mythical heroes, heiau, fishponds, wind and rain names, and their metaphoric value to ancient and modern Hawaiian culture. Uses Hawaiian terminology.",3,HWST,141839,Class Hours: 3 lecture; Prerequisites: HWST 107 or 111 or 270; and HAW 102; or consent.
HWST,270,Hawaiian Mythology,"Surveys the gods, ‘aumākua, kīpua, mythical heroes, heroines, and their kinolau as the basis of traditional Hawaiian metaphor.",3,HWST,141839,"Class Hours: 3 lecture; Prerequisites: HWST 107 or HAW 102, or consent."
HWST,286,Kaho‘olawe: Aloha ‘āina,"Develops and expands students’ consciousness towards Kaho‘olawe and the practice of Aloha ‘āina. Employs a native Hawaiian worldview in studying the cultural history of Kaho‘olawe. Provides hands-on opportunities to practice Aloha ‘āina. Empowers students to become stewards and participate in the protection, restoration, and revitalization of Hawai‘i Nei. Requires access and volunteer work on Kaho‘olawe.",3,HWST,141839,"Class Hours: 3 lecture; Prerequisites: HWST 107 or 231, either with grade C or better, or consent"
HWST,289,He Mele Kumulipo: Hawai'i's Song of Creation,"Analyzes the Kumulipo, a Hawaiian creation song that encompasses the creation of the universe, earth, plants, animals, and humans. Identifies and analyzes Hawaiian histories, concepts, philosophies, and genealogies.",3,HWST,141839,"Class Hours: 3 lecture; Prerequisites: HWST 107 with grade C or better, or consent."
HWST,291,Modern Issues in Hawai‘i,"Introduces contemporary, domestic and international Hawaiian issues within historical, social, cultural and political contexts. Engages students in research, question, critique, and development of their own critical analysis and commentary on diverse issues.",3,Hawai'i Studies,141839,"Class Hours: 3 lecture; Prerequisites: HWST 107 and ENG 100, both with grade C or better, or consent."
HLTH,122,Introduction to Physical Therapy Support Skills,"Provides theoretical understanding of working with adults and children with disabilities or neuropathologies in home and community settings; supports families, parents and caregivers. Students learn to perform scenarios of therapeutic interventions and to work with therapists and allied health professionals who provide assessment, planning, and delivery of appropriate related services. Values promoted include family-centered care, cultural sensitivity, age-appropriate activities, functional skills, and collaborative teamwork. Prepares Therapeutic Activity Aides to work under supervision of a registered Physical Therapist. (Letter grade only.)",3,Health,141839,"Class Hours: 3 lecture; Prerequisites: Certificate of Competence for Therapeutic Activity Aide I, or consent."
HLTH,125,Survey of Medical Terminology,"Surveys medical terminology including: prefixes, suffixes, and word roots; pronunciation, spelling and definition of selected medical words dealing with all human body systems; commonly used abbreviations; and use of the medical dictionary.",1,Health,141839,"Class Hours: 1 lecture; Prerequisites: ENG 19 with grade C or better or placement at least ENG 22, or consent."
HLTH,129,Terminology for Health Careers,"Develops knowledge of medical terminology, abbreviations, diagnostic tests and procedures commonly used in medical settings. Material will address all systems of the body in depth with an emphasis on increasing professional vocabulary and proficiency in spelling medical terms.",3,Health,141839,"Class Hours: 3 lecture; Prerequisites: BIOL 100 and NURS 100, both with grade C or better, or consent."
HLTH,150,Introduction to the Study of Disease,Introduces basic concepts and characteristics of the disease processes. Discusses diseases related to specific body systems.,1,Health,141839,"Class Hours: 1 lecture; Prerequisites: ENG 19 with grade C or better or placement at least ENG 22, or consent."
HIST,151,World History to 1500,A global and historical survey focusing on human societies and cross-cultural interactions to 1500 CE.,3,History,141839,"Class Hours: 3 lecture; Prerequisites: ENG 22 with grade C or better, or placement at ENG 100; or consent."
HIST,152,World History Since 1500,A global and historical survey focusing on human societies and cross-cultural interactions since 1500 CE.,3,History,141839,"Class Hours: 3 lecture; Prerequisites: ENG 22 with grade C or better, or placement at ENG 100; or consent."
HIST,241,Civilizations of Asia I,"Interprets and compares the development and interaction of the political, economic, and cultural elements in the major civilizations of Asia from earliest times to contact with the West.",3,History,141839,"Class Hours: 3 lecture; Prerequisites: ENG 100 (or concurrent), or consent."
HIST,242,Civilizations of Asia II,Surveys the impact of Western civilization upon major civilizations of Asia and the Asian response to this impact.,3,History,141839,"Class Hours: 3 lecture; Prerequisites: ENG 100 (or concurrent), or consent."
HIST,253,Contemporary World History,"Examines the political, cultural, economic, and technological history of the world from the end of WWII to the present.",3,History,141839,"Class Hours: 3 lecture; Prerequisites: ENG 22 with grade C or better, or placement at ENG 100, or consent."
HIST,281,Introduction to American History,"Develops understanding of the progress of American culture up to the Civil War, an insight into America’s heritage, and a sensitivity to its ideals and realities.",3,History,141839,"Class Hours: 3 lecture; Prerequisites: ENG 100 (or concurrent), or consent."
HIST,282,Introduction to American History,"Develops understanding of the progress of American culture since the Civil War, an insight into America’s heritage, and sensitivity to its ideals and realities.",3,History,141839,"Class Hours: 3 lecture; Prerequisites: ENG 100 (or concurrent), or consent."
HIST,283,U.S. Women‘s History,Examines the broad factors that have shaped women's lives in the United States from the pre-colonial period to the present.,3,History,141839,"Class Hours: 3 lecture; Prerequisites: HIST 151 or HIST 152, either with a grade C or better, or consent."
HIST,284,History of the Hawaiian Islands,Surveys the history of the Hawaiian Islands from Polynesian chiefdoms to Hawaiian Kingdom to American territory and state.,3,History,141839,"Class Hours: 3 lecture; Prerequisites: ENG 22 with grade C or better, or placement at ENG 100; or consent."
HIST,288,History of the Pacific Islands,"Surveys the cultural areas of the Pacific from pre-contact to present day. Covers prehistoric migration patterns, historical movements, and present day distributions, including western colonization and current problems. (Crosslisted as ANTH 235.)",3,History,141839,"Class Hours: 3 lecture; Prerequisites: ENG 22 with grade C or better, or placement at ENG 100, or consent."
HOST,100,Career and Customer Service Skills,Focuses on the strategies and skills related to career success and customer satisfaction in the Hospitality & Tourism industry.,3,HOST,141839,Class Hours: 4 lecture
HOST,101,Introduction to Hospitality and Tourism,"Provides an overview of the travel industry and related major business components. Analysis of links between hotel, food, transportation, recreation, and other tourism-related industries will be addressed.",3,HOST,141839,Class Hours: 3 lecture
HOST,150,Housekeeping Operations,"Studies the professional management of housekeeping operations including practical applications and management skills required to ensure quality, service and effective performance.",3,HOST,141839,Class Hours: 3 lecture
HOST,152,Front Office Operations,"Studies the philosophy, theory, equipment, and current operating procedures of a hotel front office. Concentrates on the human relation skills necessary for effective guests and employee relations and the technical skills necessary to operate a manual, mechanical or computerized front office operation.",3,HOST,141839,Class Hours: 3 lecture
HOST,154,Food & Beverage Operations,"Introduces the basic principles of marketing, menu planning, service styles, nutrition, sanitation and safety, purchasing, and control systems as they apply to food and beverage management in an operational setting. Provides practical applications for effectively managing resources for food and beverage industry operations.",3,HOST,141839,Class Hours: 3 lecture
HOST,258,Hospitality Marketing,Provides students with essential knowledge and practical experience to develop strategic and operating marketing plans for hospitality properties. Emphasizes the marketing orientation as a management philosophy that guides the design and delivery of guest services. Examines the dynamic relationship between hospitality marketing and daily operations.,3,HOST,141839,"Class Hours: 3 lecture; Prerequisites: HOST 101 with grade C or better, and ENG 22 with grade C or better or placement at ENG 100, or consent"
HOST,260,Hospitality Law,Focuses on legal aspects of the hospitality industry with emphasis on compliance and prevention of liabilities. Examines possible consequences of failure to satisfy legal obligations and provides specific perspectives on managing risk.,3,HOST,141839,"Class Hours: 3 lecture; Prerequisites: HOST 101 with grade C or better, and ENG 22 with grade C or better or placement at ENG 100, or consent"
HOST,261,Events Management,"Prepares students to plan and administer successful functions, special events, meetings and conventions. Students explore topics such as exhibitions, convention programming, festivals, venue selection, social events, catering needs, sustainability, technology, careers and staffing, event marketing, design and decor, and current trends.",3,HOST,141839,"Class Hours: 3 lecture; Prerequisites: HOST 101 with grade C or better, or consent"
HOST,280,Hospitality Management,"Examines the key principles of management in the hospitality industry. Focuses on leadership skill building and decision-making processes within the various management levels of a hospitality organization. Explores management concepts, strategies, and tools essential for organizational effectiveness. (Formerly HOST 270)",3,HOST,141839,"Class Hours: 3 lecture; Prerequisites: HOST 101 with grade C or better, and ENG 22 with grade C or better or placement at ENG 100, or consent"
HOST,293,Hospitality & Tourism Internship,Provides a supervised field experience that is related to the student’s major or career goals. The experience will enable the student to apply knowledge and skills learned in coursework to the work environment. (Letter grade only). (Formerly HOST 200),3,HOST,141839,"Class Hours: 15 lecture; Prerequisites: HOST major; HOST 100 with grade C or better, or consent"
HOST,294,Hospitality and Tourism Internship Abroad,Provides a supervised field experience abroad that is related to the student’s major or career goals. The experience will enable the student to apply knowledge and skills learned in coursework to the work environment. (Cannot be audited.),3,Hospitality and Tourism Management,141839,Class Hours: 15 lecture; Prerequisites: HOST major; HOST 100 with grade C or better; or consent.
HOST,394v,Hospitality and Tourism International Internship,"Provides an international work practicum experience in the hospitality industry. Requires students to demonstrate proficiency in job performance in a hospitality-related organization abroad. Students complete a comprehensive work-based project and outline professional goals, assess workplace issues, and prepare recommendations to solve issues. Synthesizes management theories learned in class with actual practices in the hospitality industry and formulation of a comprehensive report. (Credit/No Credit only. May be repeated for a maximum of 6 credits.)",1-3,Hospitality and Tourism Management,141839,Class Hours: 13 lecture; Prerequisites: Consent.
HDFS,230,Human Development,"Studies concepts, issues, and theories of human growth and development from conception to death. Explores systems approaches to inquiry into factors affecting growth and development. (Formerly FAMR230)",3,Human Development & Family Studies,141839,"Class Hours: 3 lecture; Prerequisites: ENG 22 or higher, or consent."
