course_prefix,course_number,course_title,course_desc,num_units,dept_name,inst_ipeds,metadata
JPN,201,Intermediate Japanese I,"Second level course in Japanese listening, reading, speaking, and writing. Introduces more advanced grammatical patterns and vocabulary words. Daily practice highly recommended.",4,JPN,141839,"Class Hours: 4 lecture; Prerequisites: JPN 102, or consent"
JPN,202,Intermediate Japanese II,Continues JPN 201. Completes introduction of major grammatical patterns of standard Japanese. Daily practice highly recommended.,4,JPN,141839,"Class Hours: 4 lecture; Prerequisites: JPN 201, or consent"
JOUR,250,Media Writing,"Introduces the fundamentals of journalism including media ethics, fact gathering, and interviewing to produce written material for varied media.",3,Journalism,141839,"Class Hours: 3 lecture; Prerequisites: ENG 100 with grade C or better, or consent."
LSK,110,College Learning Skills,"Enhances students’ abilities to succeed academically. Investigates communication and organizational skills, methods of inquiry, creative thinking skills, cognitive learning styles, and academic and community resources.",3,Learning Skills,141839,"Class Hours: 3 lecture; Prerequisites: ENG 22 with grade C or better, or placement at ENG 100, or consent."
LING,102,Introduction to the Study of Language,"Investigates the nature and workings of language: its composition (sound system, grammatical structure, and lexicon), representation (oral and written), and divergence (relationships between languages of the world). General linguistic principles applicable to all languages will be covered.",3,Linguistics,141839,"Class Hours: 3 lecture; Prerequisites: ENG 100 or 102, or placement at ENG 100, or consent."
MAIN,130,Masonry,"Introduces materials and explains techniques used in installing and repairing concrete, hollow tile, and related masonry construction. (Formerly MAIN 30)",2,Maintenance,141839,
MAIN,140,Painting & Decorating,"Introduces materials and explains techniques used in applying and maintaining paints, wallpaper, and plaster. (Formerly MAIN 40)",2,Maintenance,141839,
MAIN,150,Plumbing I,"Introduces materials and explains techniques used to install and maintain plumbing lines, fixtures, and controls. Emphasizes effective maintenance procedures for commercial structures. (Formerly MAIN 50)",2,Maintenance,141839,
MAIN,155,Plumbing II,Studies the plumbing system of the typical single-family residential dwelling. Examines how local and national codes apply to residential units. (Formerly MAIN 55),2,Maintenance,141839,"Class Hours: 2 lecture; Prerequisites: MAIN 150, or consent."
MAIN,160,Small Equipment Repair,"Introduces the repair and maintenance of small engines, appliances, garden equipment, and power tools. Examines troubleshooting techniques and emphasizes repair fundamentals. (Formerly MAIN 60)",2,Maintenance,141839,
MAIN,165,Air Conditioning and Refrigeration,"Studies air conditioning systems of residential and commercial buildings. Explores the servicing of small appliances (Type I), and servicing or disposing of high or very high-pressure appliances (Type II), except motor vehicle ACs. Introduces skills and concepts of planning, testing, troubleshooting, and balancing such systems. (Formerly MAIN 65)",2,Maintenance,141839,
MAIN,166,"Heating, Venting, Air Conditioning and Refrigeration (HVACR) Refrigerant Recovery","Covers laws and regulations for the recovery, reclamation, and recycle or refrigerants used in small appliances (Type I), high or very high-pressure appliances (Type II), and low-pressure appliances (Type III), except motor vehicle ACs. Prepares students to take the Environmental Protection Agency (EPA) Section 608 Universal Technician Exam.",1,MAIN,141839,Class Hours: 1 lecture
MAIN,167,"Heating, Venting, Air Conditioning and Refrigeration (HVACR) System Design and Controls","Explores components, controls, balancing, preventive maintenance procedures, and efficiency measures for commercial HVACR and chilled water systems. Covers low-pressure refrigerant (EPA Section 608 Type III) cooling and heating systems.",2,MAIN,141839,Prerequisites: Permission of instructor.
MAIN,170,Preventive Maintenance,"Explores principles of preventive maintenance: records maintenance, replacement schedules, rust prevention, and equipment maintenance and servicing. (Formerly MAIN 70)",2,MAIN,141839,
MGT,120,Principles of Management,"Introduces the principles and concepts of management including managerial functions, motivation, leadership, and decision-making.",3,MGT,141839,"Prerequisites: ENG 19 with grade C or better, or placement at least ENG 22, or consent."
MGT,122,Human Relations in Management,"Introduces the basic concepts of individual, group, and organizational human behavior as they affect human relations, performance, and productivity within the workplace.",3,MGT,141839,"Class Hours: 3 lecture; Prerequisites: ENG 19 with grade C or better, or placement at least ENG 22, or consent."
MGT,124,Human Resources Management,"Introduces the principles, organizations and techniques of personnel administration including procurement and placement, improvement of performance, management and labor relations, remuneration and security and other human resource functions.",3,MGT,141839,"Class Hours: 3 lecture; Prerequisites: ENG 19 with grade C or better, or placement at least ENG 22, or consent."
MGT,310,Principles of Management,"Introduces activities and skills needed to successfully manage both domestic and international organizations with an emphasis on decision-making. Includes communication, work motivation, group dynamics, leadership and organizational change, conflict, personality, and teamwork. Relates these concepts to performance, job satisfaction, and organizational commitment.  (Letter grade only.)",3,MGT,141839,"Class Hours: 3 lecture; Prerequisites: BUS 120 or SSM 202, either with grade C or better, or consent."
MGT,322,Organizational Leadership and Management of Change,"Prepares managers to influence the human side of developing and implementing changes in organizations. Theory, cases, and exercises help managers to understand the socio-technical aspects of change; to see leadership as motivating organizational members; to understand their own ability to influence others; and to understand the leadership successes of noted leaders from all walks of life.",3,MGT,141839,"Class Hours: 3 lecture; Prerequisites: PSY 100 or SOC 100, either with grade C or better, or consent."
MKT,120,Principles of Marketing,"Introduces marketing concepts and the application to the process of marketing products, services, and ideas to provide value and benefits to both for-profit and non-profit organizations. Students will develop an understanding of the marketing process, analyze marketing opportunities, and develop strategies to fulfill the needs of target markets.",3,Marketing,141839,"Class Hours: 3 lecture; Prerequisites: ENG 19 with grade C or better, or placement at least ENG 22, or consent."
MKT,160,Advertising & Promotion,"Introduces the principles of advertising and promotion, including sales promotion, publicity, public relations, and selling, and their relationship to the marketing system. Stresses strategies of informing, persuading, and integrating information to create a positive image.",3,Marketing,141839,"Class Hours: 3 lecture; Prerequisites: ENG 19 with grade C or better, or placement at least ENG 22, or consent."
MKT,285,Internet/Social Media Marketing,Examines the use of internet as an effective marketing tool to enhance customer relationships and strengthen brand awareness. Examines how continually emerging internet technologies and social media are increasing marketing effectiveness and efficiency. Covers development of an internet marketing plan.,3,Marketing,141839,"Class Hours: 3 lecture; Prerequisites: BUS 150 or ICS 101, and MKT 120, both with grade C or better, or consent."
MKT,300,Principles of Marketing,"Applies the fundamental principles of successful marketing including segmentation, targeting, product development, positioning, packaging, placement, pricing, promotion, service and relationship building to development of marketing plans. Explores the impact of marketing of goods and services using the Internet, the World Wide Web, and other technologies as they emerge. (Letter grade only.)",3,Marketing,141839,"Class Hours: 3 lecture; Prerequisites: BUS 120 with grade C or better, or consent."
MKT,400,Marketing for a Digital Age,"Examines how startup and small/medium companies reach the marketplace and sustain their businesses within highly competitive industries. Recognizes the need of management to operate flexibly, making maximum effective use of scarce resources in terms of people, equipment, funds, and the opportunities that exist within new and established market niches.",3,Marketing,141839,"Class Hours: 3 lecture; Prerequisites: MKT 300 with grade C or better, or consent."
MATH,75X,Introduction to Mathematical Reasoning,"Prepares students for MATH 100, MATH 111, and MATH 115. Course topics include ratio and percent, unit conversion, graphs, data interpretation, basic algebra, solving linear equations, working with formulas with special emphasis on pattern recognition and problem solving, financial formulas, money management, exponential growth, and geometry, (A-F, N, W grades only.) Mathematics courses numbered below 100 do not count toward UHMC degrees (AA, AS, AAS, ATS, BAS). To progress to more advanced mathematics courses, students should have grade C or better in prerequisite courses. The prerequisite course is most beneficial when completed during the prior 12 months. Math placement testing or alternate placement measures are required of all students who are taking mathematics at UH Maui College. (For more info, see English and Math Placement section, or the Math Routes for Specific Majors chart.)",4,Mathematics,141839,Class Hours: 4 lecture
MATH,82,Accelerated Algebra,"Covers elementary algebra topics. Topics include operations with real numbers; linear equations and inequalities; graphing; linear systems, properties of exponents; operations and polynomials; factoring; rational expressions and equations; roots and radicals; quadratic equations; and applications. (A-F, N, W grades only.) Mathematics courses numbered below 100 do not count toward UHMC degrees (AA, AS, AAS, ATS, BAS). To progress to more advanced mathematics courses, students should have grade C or better in prerequisite courses. The prerequisite course is most beneficial when completed during the prior 12 months. Math placement testing or alternate placement measures are required of all students who are taking mathematics at UH Maui College. (For more info, see English and Math Placement section, or the Math Routes for Specific Majors chart.)",4,Mathematics,141839,"Class Hours: 4 lecture; Prerequisites: MATH 75X with grade C or better, or placement at MATH 82, or consent."
MATH,100,Survey of Mathematics,"Acquaints the non-specialist with examples of mathematical reasoning. Explores selected topics such as numeration systems, consumer math, linear and exponential growth, inductive patterns, mathematical art, probability, statistics, set theory, and logic.",3,Mathematics,141839,"Class Hours: 3 lecture; Prerequisites: MATH 75X with grade C or better, or placement at MATH 100, and ENG 22 with grade C or better or placement at ENG 100, or consent."
MATH,103,College Algebra,"Analyzes and interprets the behavior and nature of functions including linear, polynomial, exponential, log, absolute value, and piecewise-defined functions; solves systems of equations; solves application problems. To progress to more advanced mathematics courses, students should have grade C or better in prerequisite courses. The prerequisite course is most beneficial when completed during the prior 12 months. Math placement testing or alternate placement measures are required of all students who are taking mathematics at UH Maui College. (For more info, see English and Math Placement section, or the Math Routes for Specific Majors chart.)",3,Mathematics,141839,"Class Hours: 3 lecture; Prerequisites: MATH 82 with grade C or better or placement at least MATH 103, and ENG 22 with grade C or better or placement at ENG 100, or consent."
MATH,103T,College Algebra with Supplement,"Analyzes and interprets the behavior and nature of functions including linear, polynomial, exponential, log, absolute value, and piecewise defined functions; solve systems of equations; solves application problems. Reinforces learning through supplemental activities such as peer discussion and problem solving, individualized tutorial assistance and performance tracking.",5,Mathematics,141839,
MATH,111,Mathematics for Elementary Teachers I,"Explores mathematical ideas, problem solving, quantitative and symbolic reasoning. Focuses on operations and their properties, sets, counting, patterns, and algebra. To progress to more advanced mathematics courses, students should have grade C or better in prerequisite courses. The prerequisite course is most beneficial when completed during the prior 12 months. Math placement testing or alternate placement measures are required of all students who are taking mathematics at UH Maui College. (For more info, see English and Math Placement section, or the Math Routes for Specific Majors chart.)",3,Mathematics,141839,
MATH,112,Mathematics for Elementary Teachers II,"Demonstrates operations and develops the properties of the natural numbers, integers, rational numbers, and real numbers. Explores the use of mathematical operations to solve problems, including geometry, probability, and physical rates. To progress to more advanced mathematics courses, students should have grade C or better in prerequisite courses. The prerequisite course is most beneficial when completed during the prior 12 months. Math placement testing or alternate placement measures are required of all students who are taking mathematics at UH Maui College. (For more info, see English and Math Placement section, or the Math Routes for Specific Majors chart.)",3,Mathematics,141839,
MATH,115,Introduction to Statistics and Probability,"Utilizes basic statistical topics including measures of central tendency and dispersion, classification of variables, sampling techniques, elementary probability, normal and binomial probability distributions, tests of hypothesis, linear regression and correlation in order to solve problems. To progress to more advanced mathematics courses, students should have grade C or better in prerequisite courses. The prerequisite course is most beneficial when completed during the prior 12 months. Math placement testing or alternate placement measures are required of all students who are taking mathematics at UH Maui College. (For more info, see English and Math Placement section, or the Math Routes for Specific Majors chart.)",3,Mathematics,141839,
MATH,115T,Introduction to Statistics & Probability with Supplement,"Utilizes basic statistical topics including measures of central tendency and dispersion, classification of variables, sampling techniques, elementary probability, normal and binomial probability distributions, tests of hypothesis, linear regression and correlation in order to solve problems.",4,Mathematics,141839,
MATH,135,Pre-Calculus: Elementary Functions,"Investigates linear, quadratic, polynomial, rational, exponential, and logarithmic functions and related topics. This course is the first part of the precalculus sequence. To progress to more advanced mathematics courses, students should have grade C or better in prerequisite courses. The prerequisite course is most beneficial when completed during the prior 12 months. Math placement testing or alternate placement measures are required of all students who are taking mathematics at UH Maui College. (For more info, see English and Math Placement section, or the Math Routes for Specific Majors chart.)",3,Mathematics,141839,"Class Hours: 3 lecture; Prerequisites: MATH 103 with grade C or better or placement at MATH 135, or consent."
MATH,140X,"Accelerated Pre-Calculus: Elementary functions, Trigonometry and Analytic Geometry","Studies the trigonometric functions, analytic geometry, polar coordinates, vectors, and related topics. This course is the second part of the precalculus sequence. To progress to more advanced mathematics courses, students should have grade C or better in prerequisite courses. The prerequisite course is most beneficial when completed during the prior 12 months. Math placement testing or alternate placement measures are required of all students who are taking mathematics at UH Maui College. (For more info, see English and Math Placement section, or the Math Routes for Specific Majors chart.)",4,Mathematics,141839,"Class Hours: 3 lecture; Prerequisites: MATH 135 with grade C or better or placement at MATH 140, or consent."
MATH,203,Calculus for Business & Social Sciences,"Studies the basic concepts of differentiation and integration and their applications in the areas of finance, management, economics, and social sciences. To progress to more advanced mathematics courses, students should have grade C or better in prerequisite courses. The prerequisite course is most beneficial when completed during the prior 12 months. Math placement testing or alternate placement measures are required of all students who are taking mathematics at UH Maui College. (For more info, see English and Math Placement section, or the Math Routes for Specific Majors chart.)",3,Mathematics,141839,
MATH,241,Calculus I,"Explores basic concepts of differential and integral calculus. Reviews functions, focuses on differentiation and its applications. Introduces integration. (Formerly MATH 205.) To progress to more advanced mathematics courses, students should have grade C or better in prerequisite courses. The prerequisite course is most beneficial when completed during the prior 12 months. Math placement testing or alternate placement measures are required of all students who are taking mathematics at UH Maui College. (For more info, see English and Math Placement section, or the Math Routes for Specific Majors chart.)",4,Mathematics,141839,
MATH,242,Calculus II,"Extends and completes the calculus on a single real variable with the differentiation and integration of transcendental functions, techniques of integration, applications, and infinite series. (Formerly MATH 206.) To progress to more advanced mathematics courses, students should have grade C or better in prerequisite courses. The prerequisite course is most beneficial when completed during the prior 12 months. Math placement testing or alternate placement measures are required of all students who are taking mathematics at UH Maui College. (For more info, see English and Math Placement section, or the Math Routes for Specific Majors chart.)",4,Mathematics,141839,
MATH,243,Calculus III,"Studies functions of several variables including vectors, vector functions, the calculus on these functions, and 3-dimensional analytic geometry. (Formerly MATH 231.)",3,Mathematics,141839,
MATH,244,Calculus IV,Extends the study of functions of several variables with multiple integrals and vector analysis. Studies the solutions of elementary differential equations. (Formerly MATH 232.),3,MATH,141839,"Class Hours: 3 lecture; Prerequisites: MATH 243 with grade C or better, or consent."
MICR,130,General Microbiology,"Introduces fundamentals of microbiology. Explains role of microorganisms and how they affect humans. Emphasizes medical and public health aspects, bacterial and viral diseases, and epidemiology. To progress to more advanced mathematics courses, students should have grade C or better in prerequisite courses. The prerequisite course is most beneficial when completed during the prior 12 months. Math placement testing or alternate placement measures are required of all students who are taking mathematics at UH Maui College. (For more info, see English and Math Placement section, or the Math Routes for Specific Majors chart.)",3,MICR,141839,"Class Hours: 3 lecture; Prerequisites: ENG 100 with grade C or better, and MATH 82 with grade C or better (or concurrent) or placement at least MATH 100, or consent."
MICR,140,General Microbiology Lab,Laboratory to accompany MICR 130.,2,MICR,141839,
HWST/MUS,176,History and Development of Hawaiian Music,"Focuses on the history and development of traditional and acculturated vocal and instrumental Hawaiian music. Discusses Hawaiian dance genres related to the music. Examines Hawaiian music and dance as an organization of sound and movement and as a product of culture and people. Uses sound recordings, video presentations, and live performances of the various music genres discussed.",3,HWST/MUS,141839,"Class Hours: 3 lecture; Prerequisites: HAW 101 and HWST 107, both with a grade C or better, or consent."
MUS,106,Introduction to Music Literature,Treats styles and forms of Western music. Develops skills in listening to and appreciating music. Introduces music styles in their historical and social contexts.,3,MUS,141839,Class Hours: 3 lecture
MUS,107,Music in World Cultures,"Analyzes folk, popular, and art music from major regions of the world, with emphasis on Asia and the Pacific. Develops a knowledge of representative styles and regional characteristics in world music.",3,MUS,141839,Class Hours: 3 lecture
MUS,108,Music Fundamentals,"Introduces basic musical concepts to enable students to express themselves as budding composers, performers, listeners and teachers. Develops skills in listening to and writing down examples, clapping out rhythms, melodies and chords. Designed for the beginner with no previous musical training.",3,MUS,141839,Class Hours: 3 lecture
MUS,114,College Chorus,Introduces performance of choral literature from the Renaissance to the present. Includes fundamentals of music and voice training. (May be repeated without limit for credit.),2,MUS,141839,Class Hours: 1 lecture
MUS,114H,Hawaiian Chorus,Introduces basic vocal group performance. Studies ancient to modern Hawaiian songs.,2,Music,141839,Class Hours: 1 lecture
MUS,121B,Voice 1,"Introduces principles of voice production as related to problems of voice literature, both technical and interpretive, at an elementary level. (Formerly MUS 123)",2,Music,141839,Class Hours: 1 lecture
MUS,121C,Piano 1,"Develops basic keyboard skills established during the first semester, including both reading and playing by ear. Repertoire expands to a variety of styles, including classical, pop, jazz, and rock. (Cannot be audited.)",2,Music,141839,Class Hours: 1 lecture; Prerequisites: Must have access to piano or keyboard.
MUS,121D,Guitar 1,"Introduces classroom instruction in guitar playing. Develops basic guitar technique by covering hand positions, fingering, scales, chords, and arpeggios. Teaches music reading. Applies reading skills to performance. Introduces a variety of guitar literature.",2,Music,141839,Class Hours: 1 lecture; Prerequisites: Guitar in playable condition.
MUS,121F,Slack Key Guitar 1,"Examines the history, development, and influential performers of Hawaiian slack key guitar, and introduces repertoire, tunings, and performance techniques that students will demonstrate during in-class and outside performances.",2,Music,141839,Class Hours: 1 lecture; Prerequisites: Regular access to a steel or nylon string guitar in adequate condition for class use and practice.
MUS,121G,Hawaiian Steel Guitar 1,"Examines the history, development, and influential performers of Hawaiian steel guitar, and introduces repertoire, tunings, and performance techniques that students will demonstrate during in-class and outside performances.",2,Music,141839,Class Hours: 1 lecture; Prerequisites: Regular access to a steel guitar in adequate condition for class use and practice.
MUS,121Z,‘Ukulele 1,Introduces Hawaiian-style ukulele playing. Students learn to play the ukulele through a selection of traditional and contemporary American and Hawaiian songs. An introduction to ukulele history in Hawai`i is included. No prior experience necessary.,2,Music,141839,Class Hours: 1 lecture
MUS,122B,Voice 2,"Develops principles of voice production as related to problems of voice literature, both technical and interpretive, at an elementary level. (Formerly MUS 124)",2,Music,141839,"Class Hours: 1 lecture; Prerequisites: MUS 121B with grade C or better, or consent."
MUS,122C,Piano 2,"Must have access to piano or keyboard. Develops basic keyboard skills established during the first semester, including both reading and playing by ear. Repertoire expands to a variety of styles, including classical, pop, jazz, and rock. (Cannot be audited.)",2,Music,141839,"Class Hours: 1 lecture; Prerequisites: MUS 121C with grade C or better, or consent."
MUS,122D,Guitar 2,"Investigates further guitar techniques, ensemble and solo playing. Introduces sight reading. Develops skill in interpretation.",2,Music,141839,"Class Hours: 1 lecture; Prerequisites: MUS 121D, or consent. Requires a guitar in playable condition."
MUS,122G,Hawaiian Steel Guitar 2,"Expands the study of performance in melody and vocal accompaniment playing styles demonstrated during in-class and outside performances. Continues the examination of styles of influential Hawaiian steel guitar performers, repertoire, and technique.",2,Music,141839,"Class Hours: 1 lecture; Prerequisites: MUS 121G with grade C or better, or consent. Students must own or have regular access to a steel guitar in adequate condition for class use and practice."
